,Title,Post Text,ID,Score,Total Comments,Post URL
241,"Jordan ""carnivore"" Peterson protection from vaccines",,10wd3eu,1892,84,https://i.redd.it/5yl5y3m2yuga1.jpg
242,Elon allowing anti vax bs back on twitter? Not surprised.,,z8mpii,1892,75,https://www.reddit.com/gallery/z8mpii
243,Antivaxxers in their natural habitat,,xqe8q3,1890,178,https://i.redd.it/vmuft04r8dq91.png
244,Fantastic insanity.,,wowhas,1891,50,https://i.redd.it/c6b968hhxuh91.jpg
245,Orphans,,xcefwb,1886,36,https://i.redd.it/r2ryo8r29vm91.jpg
246,"I have jets, you know?",,wz02rb,1882,48,https://i.redd.it/vrhjwd5km8k91.jpg
247,Todays offering from my FIL.,,1087if8,1873,84,https://i.redd.it/lsda4r2es8ba1.jpg
248,"""The vaccine is installing extra chromosomes!""",,yv4l2u,1869,155,https://i.redd.it/du36mdboivz91.jpg
249,"Ghoul Steve Kirsch, Anti-Vaxxer who harasses people with his constant demand for dishonest ""debates"" making fun of a doctor and Pro-Vax advocate who died at 77 years old.",,10ejuwy,1855,60,https://i.redd.it/p24fbco3fnca1.png
250,AnDErChR0mE,,x3zdua,1863,105,https://i.redd.it/st67x905j7i91.png
251,“Personality changes”,,ypsh0e,1849,70,https://i.redd.it/nrz210zyfry91.jpg
252,Something seems...off about this.,,w0wlng,1848,69,https://i.redd.it/wt4moamxf1c91.jpg
253,Cancer patient claims to know more than her oncologist,,106qkc9,1841,143,https://i.redd.it/2n2kawwkgvaa1.jpg
254,What did you think was going to happen.,,12gzaac,1841,83,https://i.imgur.com/WgebCFh.jpg
255,Larry Cook is back on twitter. Fuck you Elon,,13ash3y,1834,102,https://i.redd.it/bxqqh9qbuyxa1.jpg
256,In my driveway yesterday.,,10dhn20,1837,200,https://i.imgur.com/ARYoA55.jpg
257,r/thathappened,,zfeiub,1838,68,https://i.redd.it/idhwr2asrk4a1.jpg
258,Seriously? You think that was bragging?,,13wpyyb,1834,52,https://i.redd.it/a7dixta2piya1.jpg
259,Antivax doctor tells his followers to nebulize Hydrogen Peroxide - DO NOT DO THIS! IT CAN KILL YOU.,,110z5p1,1828,136,https://i.redd.it/sg7cbm1htvha1.png
260,Grandma's in a better place. A place where there are no antivaxxers.,,112l1e6,1815,85,https://i.redd.it/auwl59p7ykha1.jpg
261,My genes remain unaltered,,1139wx7,1805,129,https://i.redd.it/1unavz31ofia1.jpg
262,Covidiot doesn't understand the meaning of eugenics,,v9kvp3,1806,29,https://i.redd.it/6oi2pky80u491.jpg
263,Chiropractors aren't real medical professionals and you should avoid them!,,yzjuf8,1804,179,https://www.reddit.com/gallery/yz92p7
264,Sure.,,wlpyvq,1795,68,https://i.redd.it/61xmkaait2h91.jpg
265,These people are acting like Covid only existed when the lockdowns in the US started. *FACEPALM*,,10gkuwd,1782,96,https://i.redd.it/5wnghbu104da1.png
266,"""I'm not often wrong"" says antivaxxer who's afraid of LED lights",,1192j6t,1773,100,https://i.imgur.com/pIzfPHc.jpg
267,Embarassing,,137nsfe,1777,98,https://i.redd.it/crbndl9lpaxa1.png
268,Oh fuck you Larry,,13hsd9z,1768,87,https://i.redd.it/3v3z4qa3ovza1.jpg
269,From an antivaxx account,,13gknun,1765,72,https://i.redd.it/vpnehwvdsfza1.jpg
270,Anecdotes aren't evidence,,v8izmc,1765,87,https://i.redd.it/sdko78hcy7491.png
271,Delusional,,zuev3c,1758,111,https://i.imgur.com/mjWquhk.jpg
272,Fuck you Robert F. Kennedy Jr,,12yob6g,1759,201,https://i.redd.it/ugk9ihsbs2wa1.png
273,"They really are a gaggle of narcissists, aren’t they?",,11fazur,1744,189,https://i.redd.it/ce7gnifon7la1.jpg
274,"If someone with sever Trypanophobia can get vaccines, so can you!",,wb9zly,1738,48,https://i.redd.it/ak8t2p78gje91.jpg
275,Doc who thinks vaccinated people are magnetic is in big trouble with med board,,yi8zn1,1736,62,https://arstechnica.com/science/2022/10/doc-who-thinks-vaccinated-people-are-magnetic-is-in-big-trouble-with-med-board/
276,“THERES RESEARCH SUPPORTING THAT”,,y7nmyz,1733,77,https://i.redd.it/lcup34i8pnu91.jpg
277,Didn't take long,,1029iy7,1728,112,https://i.redd.it/k9zj7i1fqv9a1.jpg
278,"Anti-Vax Harassment Campaign against a grieving family, because... why not?!",,zge1hj,1729,65,https://i.redd.it/ntjlyubf2r4a1.png
279,Shedding parasites for a **full month** you say?,,12dnnxn,1725,80,https://i.redd.it/9jcnfmivv5sa1.jpg
280,I come down to London and this is the first thing I see,,xnkvz5,1704,38,https://www.reddit.com/gallery/xnkvz5
281,Amtivaxxer can't tell the difference between weed killers and vaccines,,xeiia4,1697,48,https://i.redd.it/8eu6gnh9njn91.png
282,"And then Dr. Fauci came in, admitted his lies and gave her a Nobel price.",,138qnxv,1691,142,https://i.redd.it/i3qqamevh2ya1.jpg
283,It must be true because she's a nurse,,wjvmog,1691,105,https://i.redd.it/b2t4fvoepmg91.jpg
284,Diary of a Wimpy Kid is throwing some shade,,yrjju0,1663,12,https://i.redd.it/m0f4p8rvd5z91.jpg
285,Posts that trigger this level of second-hand embarrassment should come with a health warning.,,13djbq2,1633,117,https://i.redd.it/1w1ktu72zzya1.jpg
286,"""We tried dying to own the libs, and now we're dying and its the libs fault""",,11bqz4b,1636,91,https://i.redd.it/gr15pyp2hdka1.jpg
287,Ben Garrison at it again,,xvmiab,1620,57,https://i.redd.it/3sutxcqtztr91.jpg
288,Anti-Vaxxers are straight up evil towards autistic people.,,xip5jq,1616,82,https://www.reddit.com/gallery/xip5jq
289,Three Years to Live,,yfqg28,1607,140,https://i.redd.it/6aywffyasnu91.png
290,Dr Drew: of course he's an antivaxxer,,10h2zg4,1615,145,https://i.redd.it/o1vmaxdnbt9a1.jpg
291,Pure harvest.,,x0j2c7,1596,56,https://i.redd.it/ai5gigdr0mk91.jpg
292,This antivaxxer won't take antibiotics. And now she has some dental problems.,,12pl80i,1575,160,https://i.redd.it/6ifphy33yita1.jpg
293,Covidiot,,123pid1,1570,87,https://i.redd.it/loeqak9ybooa1.png
294,Idiot makes a social media post,,xco9ua,1570,89,https://i.redd.it/30e9cmgrbrp81.jpg
295,"Nothing to see here, folks. Just totally normal threatening of medical professionals with the death penalty.",,ynm4xg,1554,74,https://i.redd.it/shfpyyvy0by91.png
296,"Couldn't possibly be the thousands of pounds of lung-corroding acid it was carrying. Nah, definitely vaccines.",,112sw1f,1553,47,https://i.redd.it/9jdxb5copcia1.jpg
297,The article is about a man who killed his son in a murder suicide to prevent him from being vaxxed. The reblogs are as hinged as you'd imagine.,"I doubt a lot of them actually read the article, but I'm not sure if that's better or worse than genuinely believing this little boy is better off dead than vaccinated. 

Rest in peace, Pierce.",12tjp16,1538,106,https://www.reddit.com/gallery/12tjp16
298,Ted Nugent is a real american ZERO.,,wrwg6p,1525,53,https://i.redd.it/c7d702u1qji91.jpg
299,So close and yet so far,,1044zsa,1520,35,https://i.redd.it/yd3zzlyjf5aa1.jpg
300,Stew is at it again! This time you have to read it.,,11godvw,1514,160,https://i.redd.it/gzaybutz5hla1.jpg
301,Child needs a transfusion-mother wants to wait until *unvaccinated blood* is available.,,wsfgek,1512,151,https://i.redd.it/w6tyo1b5jai91.jpg
302,"found on a twitter thread about blood donation to an infant leukaemia patient, appalling",,110gxe5,1516,74,https://i.redd.it/t6c6ebkx6tha1.jpg
303,My FIL is deep down the rabbit-hole! 🙄,,10770nf,1504,58,https://i.redd.it/garpln0170ba1.jpg
304,Darkening eyes and other changes.,,xn1toi,1506,70,https://i.redd.it/ifykvzy7zup91.jpg
305,"Facts? Who needs those? This Anti-Vaxxer can't accept that over 1000 children died of Covid in the US and will rather make up his own numbers regarding ""vaccine deaths"".",,zlpfkn,1505,37,https://i.redd.it/gntk9kxscw5a1.png
306,"Antivaxxer ""influencers"" are scumbags.",,100scmt,1494,29,https://i.redd.it/sddximiuph9a1.png
307,"Well, it was fun while it lasted guys...",,13psv0k,1485,123,https://i.redd.it/scyg1qm9cn1b1.jpg
308,More from FIL.,,108k8cc,1477,103,https://i.redd.it/de8tnrgsibba1.jpg
309,Antivaxxers having a normal response to news about Santa,,zu0vot,1475,60,https://www.reddit.com/gallery/zu0vot
310,Wicked is the new word for vaccinated in crazy-land it seems.,,x1ttz7,1480,47,https://i.redd.it/joh497qhwwk91.png
311,Of course he's antivaxx,,zt3hdq,1475,82,https://i.redd.it/z7oh6gh5bi7a1.jpg
312,Saw this comment on a FB friend’s post and I just can’t,,114ov0m,1466,47,https://i.redd.it/h22iiaf18tia1.jpg
313,"Harvard is jumping on this now too, according to the anti vaxxers...",,xf2yyr,1467,121,https://i.redd.it/p2a2uk8i72o91.jpg
314,Started seeing this ad and similar on reddit today. Wtf?,,11woudj,1462,151,https://i.redd.it/5kfu7cpwxyoa1.jpg
315,The absolute HORROR!!! mRNA in meat!,,129l7nk,1460,141,https://i.redd.it/990yrd0jkira1.png
316,Study: Not only is there no link between the MMR vaccine and autism. The rate of autistic people was higher in the UNVACCINATED GROUP,,12vw5mr,1455,63,https://www.clearvuehealth.com/b/autism-mmr-stats/
317,The dude that post this stuff always says “you can find it yourself” when you ask for sources,,vcwo0v,1452,96,https://i.redd.it/blyqhz68ws591.jpg
318,"Antivaxxer offers his unvaxxed semen at a ""pregnancy retreat""",,139uag3,1453,65,https://i.redd.it/5pd84wyh72ya1.png
319,Alberta judge rules that it’s NOT unconstitutional to refuse a lung transplant for woman who refuses to get COVID-19 vaccination.,,vxue2o,1445,52,https://www.cbc.ca/news/canada/edmonton/covid-19-vaccine-transplant-charter-rights-1.6518642
320,Youtube is promoting medical misinformation.,,124xvhm,1448,114,https://i.redd.it/b3o0syq1fkqa1.jpg
321,I know someone who never got vaxxed and their fine.,,10sig0f,1451,84,https://i.redd.it/7rqfkwhc60ga1.jpg
322,"On an article about breakthroughs with HIV research, buddy started bringing up “dangers” of mRNA",,zd9ftg,1449,52,https://i.redd.it/hnz9ju6b054a1.jpg
323,"Guys, I finally got it to connect properly! /s",,y4qp2z,1448,34,https://i.redd.it/qpf4v717mzt91.jpg
324,CDC makes a joke post. r/conspiracy takes it seriously,,zpxnhh,1444,77,https://i.redd.it/ewpwag91za6a1.png
325,smug,,z5bqd5,1441,104,https://i.redd.it/bpz8n3c6r02a1.jpg
326,"*Eyeroll* Riveting Satire, Babylon Bee",,10lxogt,1434,44,https://i.redd.it/sy4t8leccfea1.png
327,"3 doctors tragically die, two of them after long battles with cancer, Big Brains on r/DebateVaccines are, of course, quick to connect the dots (where everyone else is too ""stupid"" to do so)",,wb634h,1422,52,https://i.redd.it/w7tumtpqmie91.png
328,"r/conspiracy hysteria and disinformation : ""In 100 years no one will have an immune system. Vaccines will destroy them""",,1064xfm,1427,109,https://i.redd.it/vuwrgxl4jpaa1.jpg
329,Happy Activation Day! Is anyone else feeling the mRNA poison?,,y0vm0h,1424,156,https://i.redd.it/gss882ydu2t91.jpg
330,"Oh #diedsuddenly is trending, let’s see what antivaxxers have to say… oh no",,z283w9,1418,98,https://www.reddit.com/gallery/z283w9
331,This.,,125pcry,1398,11,https://i.redd.it/r9ru249t9qqa1.jpg
332,"Vaccines make you a zombie, apparently.",,wm0btd,1396,40,https://i.redd.it/cyrd1nie15h91.png
333,An Ivermectin Influencer Died. Now His Followers Are Worried About Their Own ‘Severe’ Symptoms.,,12z955p,1390,112,https://www.vice.com/en/article/z3mb89/ivermectin-danny-lemoi-death
334,"The good old ""shedding"" chestnut again.",,yxbp3r,1384,55,https://i.redd.it/ro216tw5se0a1.png
335,"Dr. Simone Gold was among those sentenced in the January 6th insurrection. The judge also slammed her org for disinformation and lying about ""political persecution,"" which she fundraised off of, calling her ""unseemly,"" and more.",,11cj7in,1391,10,https://i.redd.it/8krdykp89lka1.jpg
336,I don't believe that you saw a real doctor,,13u4xoc,1384,118,https://i.redd.it/7646vvf7le2b1.png
337,The good old vaccine shedding chestnut again.,,wrwtq9,1386,39,https://i.redd.it/txkj1edpsji91.png
338,Their brother was injured in a car accident on his way home from an appointment with his doctor,,12gnhu8,1375,43,https://i.redd.it/cbiwv8sxpmra1.png
339,People pick the strangest things to be proud of,,wzkorv,1370,43,https://i.redd.it/ofgtoxfihbk91.jpg
340,There will never be enough sick people to suit them,,11dg5ta,1355,105,https://i.redd.it/r9je68c1ncka1.jpg
341,"Anti-vaxxers caught selling overpriced ""Vaccine injury recovery packages"" for over $1200.",,104l9r0,1359,50,https://v.redd.it/jhmfif63ucaa1
342,"This is a conversation from late 2020. Red is my Godmother, a physician. Blue is her Facebook friend.",,xjtc1w,1348,46,https://i.redd.it/1ynv3ksvq4p91.png
343,nATuRaL iMmUnItY,,yyo5c7,1348,79,https://i.redd.it/8bsy75cwt90a1.png
344,"Excuse me, did you say *torahvison*? Antivaxxer proves themselves to be antisemitic",,12s9trs,1349,85,https://i.redd.it/0ae0hyxm6xua1.jpg
345,The article is just laughable,,w37wfn,1344,20,https://i.redd.it/ke5qu9zy8mc91.jpg
346,Happy Halloween!,,yc0o6z,1345,9,https://i.redd.it/hok3fuw88ov91.jpg
347,antivaxxer will never forgive us for not wanting to get sick,,za2efq,1335,45,https://i.redd.it/nplcksb83t0a1.jpg
348,"Doctors seeing resistance to blood transfusions over unfounded COVID vaccine concerns: """"There isn't a choice to receive COVID vaccine-negative blood. So by declining blood, it means you will die.""",,y4z2pk,1327,69,https://www.msn.com/en-ca/health/medical/doctors-seeing-resistance-to-blood-transfusions-over-unfounded-covid-vaccine-concerns/ar-AA12UFYZ
349,Then my family held a celebration for me and they clapped for an entire hour.,,13chgkb,1324,126,https://i.redd.it/n0x6eu5cisya1.jpg
350,Derailed trains? r/conspiracy says they're staged. Why? To take people's attention away from all those imaginary vaccine deaths.,,116h0sl,1325,65,https://i.redd.it/ns4zxz5v21ja1.jpg
351,"God, they are fucking morons",,zr19r0,1325,101,https://i.redd.it/8w6rdsr3467a1.jpg
352,The_Donald.win having a totally normal conversation about how they treat covid,,vev6mv,1317,55,https://i.redd.it/25wxfirmv9691.jpg
353,Entitled Grandma doesn't want your dirty vaccinated blood,,12bm58t,1317,114,https://i.redd.it/vrqlwlfn7ira1.jpg
354,"Duuuuhhhh, what do the lungs do again?",,xtyt9w,1314,25,https://i.redd.it/bm341iaqbgr91.png
355,"Millions of vaccinated people, thousands of scientists with degrees, and lots of scientific studies can’t convince an anti-vaxxer, but a random bullsh*tter somehow can.",,13t1hf0,1321,24,https://i.redd.it/v84wfg5pgd2b1.jpg
356,I don’t care if you have cancer - I have my own problems.,,wclhrt,1317,65,https://i.redd.it/s5pd6ch6qve91.jpg
357,I never had a sexy nurse jab me with Bill Gates' microchip 🤬🤬🤬,,ymqgye,1308,23,https://i.redd.it/tyuzuu8l34y91.jpg
358,Anti-Vax nonsense with a side dish of transphobia.,,ygek42,1301,45,https://i.redd.it/ux2e1fkflpw91.png
359,r/conspiracy thinks we owe them an apology,,11l45zv,1290,127,https://i.imgur.com/65GxvbG.jpg
360,red alert fertility,,zhvd6l,1293,99,https://i.redd.it/vglv1bwpx54a1.png
361,Why do I have to share a planet with these people,,wchixt,1282,11,https://i.redd.it/i9bw0qkneue91.jpg
362,Vazzed blood? Separate blood banks?,,x4vpn0,1279,72,https://i.redd.it/4iq89dyy97i91.jpg
363,I would never speak to my parents again,,x10ihy,1269,21,https://i.imgur.com/ZTjBSj8.jpg
364,Sterilized by her fiance,,12g1cup,1266,63,https://i.redd.it/j63lzs0lhpsa1.jpg
365,There is no such thing as a virus says r/conspiracy,,11avt8y,1268,133,https://i.redd.it/vdhwl9j7fzja1.png
366,"Antivaxxers don’t want us to forget that they were made to feel remorse for their selfish, ignorant choices.",,zoa19f,1265,62,https://i.redd.it/17v0t7t41j6a1.jpg
367,"orange blood, clots with fingers, what!?",,wxwozl,1259,163,https://i.redd.it/mmu0e0s7wyj91.jpg
368,The responses are as stupid as you'd imagine.,,wfjxgs,1260,63,https://i.redd.it/qblsgxq6qkf91.png
369,Antivaxxer has totally sane concerns about nanoparticles in Covid test,,y3ucam,1256,121,https://i.redd.it/zcqxgq2cojt91.jpg
370,**vak scene**,,120n3du,1255,71,https://i.redd.it/92h6aqagwlpa1.jpg
371,Such disgusting people,,13zg1p3,1256,99,https://i.redd.it/kdq1cvbhaxsa1.jpg
372,Anti-Vaxxers: dU yEr ReSurCh,,10e0nnp,1247,78,https://i.redd.it/d7s8nys96kca1.jpg
373,All over a video showing Elmo getting a COVID vaccination… oh boy.,,vq8ffj,1241,40,https://i.redd.it/ft3e2rqfeb991.jpg
374,"Literally the comment section of a vintage video about rabies, in response to people saying 'vaccinate your pets.'",*'I'll only give my dog homemade vaccines or none at all!'*,10c5un6,1237,89,https://i.imgur.com/B8WWFqj.jpg
375,Posted on twitter yesterday,,13oueat,1237,108,https://i.redd.it/cotp5tb9421b1.jpg
376,Let’s go Darwin.,,10oi7qv,1234,30,https://i.redd.it/dln83wdn63fa1.jpg
377,Karlie Jerk,,13y9t7t,1236,137,https://i.redd.it/dwszehx89l3b1.png
378,smokers will what?,,11ebwxo,1231,60,https://i.redd.it/ah2yb6dgqqka1.jpg
379,This Antivaxxer trolling the PM's Instagram post decided to drop into my DMs with his condolences.,,zhobbs,1231,106,https://www.reddit.com/gallery/zhobbs
380,Wise beyond his years,,zpe20l,1229,21,https://i.redd.it/j1q6d0s7br6a1.jpg
381,Anti-vaxxers in a nutshell,,13l0elo,1233,31,https://i.redd.it/6skvvzl8ml0b1.jpg
382,"""Vaccines made my white cousin marry a black man""",,10yvcmo,1216,97,https://i.redd.it/qctx0he3waha1.jpg
383,"Hospitals are for sick people, not stupid people! My sister, RN, has Covid because one of her patients or guests was unvaxxed. Here's a big FU to all anti-vaxxers.",,xskszg,1218,15,https://i.redd.it/lz0if8ce34r91.png
384,Antivax logic 101,,11nz0kf,1209,52,https://i.redd.it/od9hkr73d0na1.jpg
385,According to r/conspiracy 54.9% of the world's population is suffering from vaccine induced AIDS,,zv6fb3,1209,88,https://i.redd.it/z2qfz1mlx38a1.png
386,Ivermectin advocate dies from horrifying side effects — and followers report 'severe' symptoms,,11qfyr0,1202,69,https://www.rawstory.com/ivermectin-2659588780/?recip_id=731234&list_id=1
387,Apparently AntiVax fan fiction exists now.,,10z4fv2,1202,141,https://www.reddit.com/gallery/10z4fv2
388,It’ll cure them right guys….right?,,y6nr2r,1202,8,https://i.redd.it/m15bdv2asfu91.jpg
389,"No good, apparently.",,wqf3kg,1192,34,https://i.redd.it/abls9o4487i91.jpg
390,That's a lot of words to tell us you're a douchebag.,,wm5d00,1185,73,https://i.redd.it/5ahawg0f36h91.png
391,Shingles is caused by covid vaccines now apparently.,,vacgoq,1189,82,https://i.redd.it/33vsj6s5r3591.png
392,seems like a group of totally well-adjusted and normal individuals,,zagnwr,1177,100,https://www.reddit.com/gallery/zagnwr
393,"Sure Elon, whatever you say",,10ion58,1167,110,https://i.redd.it/ef2xg5vk0jda1.jpg
394,American antivaxxer believes that the American government has a plan to kill 7 billion people,,z96r7f,1171,125,https://i.redd.it/pdfc85cuiz2a1.jpg
395,The Antivaxxer's Journey in Four Acts,,xzsk0q,1166,14,https://i.imgur.com/xReSqFe.jpg
396,"If that is your first question when you witness a sudden collapse, you clearly have a problem.",,ypxfd9,1164,45,https://i.redd.it/96jm83mkdsy91.png
397,Updated: These people really don’t like being called out. I’m in Green.,,10t87wk,1157,98,https://www.reddit.com/gallery/10t87wk
398,"Take THAT European Jews in the 1940s, we suffer much more than you! What did they do to you, jail you in ghettos? Don't be so dramatic",,12jkqae,1156,44,https://i.redd.it/cdamgy6s6gta1.jpg
399,"""The heart is an antenna""",,132z0t0,1150,99,https://i.redd.it/2njqga17sota1.jpg
400,"They're obsessed with this ""covid jab = thicker blood"" nonsense.",,10tp2rr,1151,82,https://i.redd.it/dtsma9c158ga1.png
401,You're going to die lady,,zm6rwv,1132,104,https://i.redd.it/w2ijp9ktgt5a1.jpg
402,Post hoc ergo porter hoc. A logical fallacy assuming that P causes Q because Q occurs after P when it could be a coincidence.,,124d1vq,1136,21,https://i.redd.it/pllgzhq4bgqa1.jpg
403,"So basically, the antivax cooko's think that if you're vaccinated, you shouldn't be given human rights anymore. These folks are out of their mind.",,xzzrf1,1130,75,https://i.redd.it/rjk4nnky8vs91.png
404,r/conspiracy lives in fear,,vg5rhn,1130,55,https://i.redd.it/xde5y6ppxh691.jpg
405,Elves? r/conspiracy has a new theory about the origin of covid,,11nuzhv,1125,50,https://i.redd.it/v2fb8nly2rka1.png
406,Vaxxtrails are real,,104ouik,1126,113,https://i.redd.it/0qj5niy4cfaa1.jpg
407,How tf is this related to football?,,zmgfej,1122,24,https://i.redd.it/lq8ukai3h26a1.jpg
408,Peak antivaxxer comedy,,13fg5sd,1124,34,https://i.redd.it/glofxon9weza1.jpg
409,Hilarious... Anti-vax Senator Inhofe retires due to long covid...,,11bk6az,1114,42,https://www.huffpost.com/entry/gop-ex-sen-inhofe-retired-due-to-long-covid-after-opposing-covid-aid_n_63f8e9b7e4b0735bf8777e81
410,Matthew_McConaughey's wife Camilla injured in a fall: The vaccines did it!,,ywe6nw,1117,49,https://i.redd.it/8s4yibyzayz91.jpg
411,Anti-vax groups use carrot emojis to hide Facebook posts,,xg16se,1107,45,https://www.bbc.com/news/technology-62877597
412,So… Yes Lady Date?,,ybysq7,1103,24,https://i.redd.it/fo2u64ztqnv91.jpg
413,Antivaxx Presidential Candidate Robert F Kennedy Jr recently pictured with convicted criminals Michael Flynn and Roger Stone,,12xkbn4,1100,40,https://pbs.twimg.com/media/FtBsscxXgAQSz95.png
414,They hate people with autism,,13xj958,1097,73,https://i.redd.it/wi1hmv3rl73b1.jpg
415,Don Quixote,,11pkm2b,1096,15,https://i.redd.it/c813suykhcna1.png
416,u lucky placebos...,,wtxnm6,1089,46,https://i.redd.it/dlrm2n2112j91.jpg
417,Remember: Trump and the Republican party made it worse than it had to be,,ymwyps,1092,30,https://i.redd.it/kh3o7ynkx0x91.jpg
418,"Of course, all Sudden Cardiac Arrests must be vaccine related, it can't be anything genetic or the virus, it must be vaccines.",,ymve7s,1080,98,https://i.redd.it/qvc8iyuo55y91.png
419,Meanwhile in sunny Ohio,,vhp2sw,1077,40,https://i.redd.it/uqk1tsbtgl591.jpg
420,Some people don't deserve children,,zmp5st,1072,75,https://i.redd.it/j6vl2ot6mw5a1.png
421,"Apparently ""erring on the side of caution"" equals ""mind control and sanctimony."" Riiiiiiight...",,xuv8gv,1063,130,https://i.redd.it/haweg84kmnr91.jpg
422,Vaccines work!,,y4l1xb,1062,45,https://i.redd.it/759hvwxgbyt91.jpg
423,Full system flush should do 'er,,13g3x3m,1057,67,https://i.redd.it/pbgyf4zjqjza1.jpg
424,r/unvaccinated at it again,,12k3xbq,1052,42,https://i.redd.it/i54ohs45rjta1.jpg
425,r/conspiracy angry that rock stars are vaccinated,,11ool3g,1046,32,https://i.redd.it/68nfq6q41iia1.jpg
426,What would you consider serious?,,wanu7c,1050,68,https://i.imgur.com/FTSam3v.jpg
427,They haven't forgotten the HPV Vaccine,,13rjlte,1040,51,https://i.redd.it/nd1i620lenya1.jpg
428,I wish!,,10rrxnx,1044,88,https://i.redd.it/jm8fynj1jsfa1.png
429,"9k+ people trust the source ""MAGA PATRIOT David""",,z6ggnh,1033,32,https://i.redd.it/fyggy43hxk2a1.png
430,tHeY're gOiNg To reLeaSE THE NEXt VIrUs,,11yn6bn,1028,70,https://i.imgur.com/26jr8pM.jpg
431,Indian government going anti vax xD,,zo30q9,1023,27,https://i.redd.it/xlraoef92h6a1.jpg
432,Husbands hate him for this one simple trick,,1251ngd,1020,158,https://i.imgur.com/4j4v49O.jpg
433,What a disgusting piece of s..t,,13njez7,1013,54,https://i.redd.it/u01dyce6r51b1.jpg
434,Is being a moron environmental or are you born with it?,,zzo05q,1010,46,https://i.redd.it/99krg8vbm69a1.jpg
435,Anybody who is trying to convince you Covid-19 vaccines only last a few months is lying to you.,"Reminder that vaccines continue to be effective AND long lasting. For March those who were vaccinated but have NOT yet recieved a bivalent booster saw 65% less covid infections than the unvaccinated and 76% less covid deaths in February. Anybody who is trying to convince you Covid-19 vaccines only last a few months is lying to you. 
https://covid.cdc.gov/covid-data-tracker/#rates-by-vaccine-status",12xbwel,1012,70,https://i.redd.it/aqxvoqu0wuva1.jpg
436,"So, when can I expect to die?",,xa1ffu,993,61,https://i.redd.it/wa9uf4kvbvm91.jpg
437,This is why we have the flu vaccine,,zzy7pg,993,84,https://i.redd.it/fn3fovo8h79a1.jpg
438,Nobody would ever manipulate this guy’s poll,,13s5rv1,982,55,https://i.redd.it/stv8dd91062b1.png
439,Now the nuts refuse to go to hospitals!,,118p03g,978,73,https://i.redd.it/2kyqc21nmpja1.jpg
440,"""Vitamin D deficient rodeo clown"" -- new favorite insult of all time.",,zz1w07,973,12,https://i.redd.it/jty5qz5sp19a1.jpg
441,Fraudulent account impersonating a dead doctor celebrates the death of a woman and lies about the cause of death. Traditional Anti-Vax narrative.,,yau94j,973,31,https://i.redd.it/gepkbuh7cev91.png
442,vaxxhappened!!,,11oj738,970,43,https://i.redd.it/nurezsvou3na1.png
443,These people have no fucking souls,,y9e2cp,958,62,https://imgur.com/KOCyOeI.jpg
444,"My FIL started “debating” worth me two years ago. He started with a link to an article about two people who nearly died due to allergic reaction to the vaccine. The rest is … well, I’ll let you judge for yourselves. There is more…",,107hn4u,956,185,https://www.reddit.com/gallery/107hn4u
445,Anti Vax/Maskers are just so kind and understanding.,"All because I mentioned how chronically ill I am and how it can be important to still wear masks in various places, like a hospital. He was a real man too and blocked me right after sending that.  

And they say pro vaccine/mask people are the cowards.",13lfb8c,942,42,https://i.redd.it/7mhnrld41q0b1.jpg
446,Antivaxxers love horses,,13f35wu,948,19,https://i.redd.it/d0aeh8cav9za1.jpg
447,A friend saw this at the gas station. I kinda want to check out the website to see how dumb it is.,,10g7jkn,932,135,https://i.redd.it/5avt1jl4t2da1.jpg
448,Detox Insanity,,zh1x51,930,76,https://i.redd.it/0n6j4b98lb4a1.jpg
449,Ivermectin doesn't work for Covid but r/conspiracy still thinks it does,,x8dwiu,921,57,https://i.imgur.com/zxnCglL.png
450,"Vaccines cause autism, because monkey gene?",,13j750n,922,113,https://i.redd.it/cruxqnv9y80b1.png
451,"""All vaccines should be outlawed"" says ignorant American on shithole website",,10huui6,921,62,https://i.redd.it/ll5hxkcfwv9a1.jpg
452,"""I don't want anyone to die but why aren't those vaxxed people dying so I can say 'I told you so?' "" r/conspiracy is disappointed that their predictions haven't come true.",,vrhjo0,922,140,https://i.redd.it/p6taj8m7wj991.png
