,Title,Post Text,ID,Score,Total Comments,Post URL
0,Tent Hospitals,,z12cgd,16980,171,https://i.redd.it/e18aa6cor61a1.jpg
1,Antivaxxers love to imagine that they're oppressed,,w22a02,13736,105,https://i.redd.it/q0f46mqqj7c91.jpg
2,Fear,,wuvcfa,10376,112,https://i.redd.it/iv64xo6d6qh91.jpg
3,Antivaxx mindset,,xpisew,9269,71,https://i.redd.it/zzhlzzrrtek91.jpg
4,Measles not included,,wnignk,9052,40,https://i.redd.it/z2cpe9xfy1h91.jpg
5,Forreal,,ve0e1y,9023,204,https://i.redd.it/b5zuwhghv2691.jpg
6,Her response literally belongs to r/murderedbywords,,vjb752,8887,209,https://i.redd.it/h2504bslpg791.png
7,Ben Garrison is an idiot,,xr8tdl,8827,515,https://i.redd.it/5v6yhjm32tq91.jpg
8,'Murica,,xy1azf,8395,45,https://i.redd.it/sjeefzkj5fr91.jpg
9,Exactly!!!,,wdni4y,8156,45,https://i.redd.it/cdf9opdd25f91.jpg
10,They’re in “found out” territory.,,wh3f3q,8142,90,https://i.redd.it/y5a4eqgzzxf91.jpg
11,Change my Mind,,zvpegf,7173,73,https://i.redd.it/rusqj2c2qbn91.jpg
12,Sounds reasonable,,wedlqy,6907,111,https://i.redd.it/avjrtlsw6id91.jpg
13,Swedish Doctor,,xgp948,6907,77,https://i.redd.it/97ilc7nf59n91.jpg
14,Welcome to America,,v6ao2q,6624,35,https://i.redd.it/1ji0pthhac291.jpg
15,Vaccines work!,,zk884v,6474,67,https://i.redd.it/uhhnet267e5a1.jpg
16,Let another dog lick it.,,ym0uuw,6304,269,https://i.redd.it/gr0bah535yx91.jpg
17,Prayers won't help,,vmt9sv,6174,76,https://i.redd.it/t9dy1g1gn4691.png
18,B-but they can cause autism 😭,,xi3dvr,5945,60,https://i.redd.it/vnnj8m6l8ro91.jpg
19,Covid discriminates against Trump supporters,,wpw4lm,5933,148,https://i.imgur.com/qFgCf3s.jpg
20,It's not a mystery,,y252t8,5888,74,https://i.redd.it/u13dgw0x6ds91.jpg
21,Apparently we glow in the dark now..,,vr5wit,5678,240,https://i.imgur.com/1mA6cbE.jpg
22,Just....great......,,zipx64,5607,393,https://i.redd.it/0dv406zfza5a1.png
23,It’s so TRUE.,,wnzedj,5585,27,https://i.redd.it/t9ld5mofhmh91.jpg
24,"mom didnt want me getting the covid vaccine, did it anyway",,11rfe1a,5528,155,https://i.redd.it/8c6v69ra5una1.jpg
25,It’s NOT over yet.,,y5hybg,5487,224,https://i.redd.it/8xek6slgf6u91.jpg
26,"Local Chiropractor, rabidly antivaxx, puts infant at risk by twisting it's tiny spine",,w5o5y3,5478,410,https://i.redd.it/zxsxaoz3wsc91.png
27,Wow a total 8 months of not being sick? That is proof we don't need vaccines,,wsk00k,5476,28,https://i.redd.it/zk9jnv78ipi91.jpg
28,Hopelessly misinformed,,y6cuvp,5415,56,https://i.imgur.com/FiQLuH2.jpg
29,Delusional Doggos,,vocinp,5396,55,https://i.redd.it/llz5adr1i2891.jpg
30,Vaccines work.,,xx5oup,5337,181,https://i.redd.it/4lgaz7hlw6s91.jpg
31,"Yes, because we moved on unlike you crybabies",How often did the predict now that all vaccinated people will die soon™?,y1ncr0,5342,123,https://i.redd.it/8fntskmid9t91.jpg
32,He won't be sleeping with anyone while in Romanian jail.,,zyps53,5330,74,https://i.redd.it/t5polx98yz8a1.jpg
33,"F#cking polio, Seriously!?",,xa8eho,5323,123,https://i.redd.it/nzdm90ddswm91.jpg
34,From an antivaxx group: These people need to be arrested,,vtlnep,5196,230,https://i.redd.it/awdrztvxdr991.jpg
35,"This! Everyone’s like, “No one wants to work!” I’m over here saying “They’re dead!” It’s like millions of people have died without a sound… until it becomes an inconvenience for the country and the capitalist machine. It’s appalling and disgusting.",,vsryfk,5120,153,https://i.redd.it/bkphhikx60a91.jpg
36,"If only Fox “News” realized that the vaccines don’t stop the risk of infection, they reduce the risk of dying from infection. There’s every chance you could still catch it but if you’re vaccinated, you’re less likely to die.",,vy3fld,5017,77,https://i.redd.it/3vbsnb4xqdb91.jpg
37,They’re not worth microchipping.,,wqurws,4942,44,https://i.redd.it/idcelt426bi91.jpg
38,Of course Tomi doesn't have the facts or data to back this false claim,,z49sbh,4890,260,https://i.redd.it/esqecnyr442a1.jpg
39,Wow a total 8 months of not being sick? That is proof we don't need vaccines,,z7oiv1,4860,42,https://i.redd.it/r9wfc2oluu2a1.jpg
40,From the hospital room of a covid patient,,122r309,4828,309,https://i.redd.it/qjzmeeh0hl881.jpg
41,Just stay home if you're sick. It's not a difficult concept.,,yf6o05,4799,107,https://i.redd.it/zbyk6vchlfw91.png
42,Snowflake,,vz785z,4721,121,https://i.redd.it/crphuiqoslb91.jpg
43,Cruelty is the point,,w4js5l,4669,179,https://i.redd.it/ljccbr0ko5c91.jpg
44,damn what a sick burn 🔥,,xlay6n,4658,127,https://i.redd.it/4yv98myxpgp91.jpg
45,It's a shame about your uncle but the vaccine didn't kill him,,yoq0vs,4596,85,https://i.imgur.com/pBA2C7a.jpg
46,Pretty good cartoon I found,,w87okx,4556,13,https://i.redd.it/o514v5ieqtd91.jpg
47,We as a species are doomed,,wcewti,4472,20,https://i.redd.it/ahw3qqaznte91.jpg
48,Breaking News:Soccer anti vaxx mom offended by a fucking decal window sticker,,yt0evs,4427,48,https://i.redd.it/yvir0lfy8hz91.jpg
49,Think she should go back to being M.I.A.,,y2t6id,4390,74,https://i.redd.it/84p11ks69jt91.jpg
50,Antivaxxer claims to have spontaneous periods in the presence of the vaccinated,,vgmmdt,4365,143,https://i.imgur.com/ZLMjvoX.jpg
51,Right?!,,y0hnfa,4247,18,https://i.redd.it/jd5arlqlyzs91.jpg
52,Covidiots believe the vaccine is responsible for Justin Bieber getting Ramsay Hunt syndrome,,v9y04r,4246,259,https://i.redd.it/ijsdk3mmyz491.png
53,Because the military vaccinates everyone?,,xk8b6i,4220,109,https://i.redd.it/1o8pkfve74p91.jpg
54,Keep doing what you're doing New Zealand. It's saving lives.,,w2jvnw,4207,91,https://i.redd.it/0h2n2pvqegc91.png
55,20 million dead from the jab... No reliable sources of course,,y4cs6c,4183,205,https://i.redd.it/fqd1k5u4xvt91.jpg
56,Everything old is new again,,x94ct1,4162,35,https://i.redd.it/kep3vzsrqgk91.jpg
57,r/conspiracy's perfect world is built upon the bodies of everyone else,,wabdxc,4158,336,https://i.redd.it/qxdhjvr6a8e91.png
58,More misinformation by RFK jr...,,v7pb41,4136,195,https://i.redd.it/ge44cj1rce491.png
59,What’s this? The cast for the new reality show 'Dateless and Desperate'?,,ybim6k,4113,99,https://i.redd.it/r0sbszpqbkv91.jpg
60,I hate when my pulse just f’s off,,10l6ww3,4089,207,https://i.redd.it/ifq8jdxv5aea1.jpg
61,"Both children are unvaccinated, Doctors haven't seen cases of Diphtheria in over 30 years. Should the parents be charged?",,vqfio4,4025,163,https://i.redd.it/o9scaxooqd991.jpg
62,How about stopping these harmful Doctors. Vaccines have saved thousands of lives.,,w0gkjv,4016,139,https://i.redd.it/ixygi60w2zb91.jpg
63,r/onejoke,,v6xz6x,4017,191,https://i.redd.it/tg5bmhoo64491.png
64,Microchip? Hell no! Neural link? Hell yes!,,zrqi0c,4002,111,https://i.redd.it/zyc40lwz9z5a1.jpg
65,"""If vaccines are so great why aren't they mentioned in the bible?""",,wxgj2e,3994,158,https://i.redd.it/nfs50b6z2jj91.jpg
66,No wonder polio is making a comeback.,,xbd469,3986,213,https://i.redd.it/mv7o6psew6n91.jpg
67,"I'm not sure what's worse, the data breach, or the fact that this site even exists.",,wifhyc,3956,79,https://i.redd.it/zcwewu6akag91.jpg
68,His pacemaker helped him to own the libs,,z63w4g,3934,179,https://i.redd.it/o2af0qf9zj2a1.jpg
69,MAGAT who flunked out of high school: fAuCi nOt ExPuRt,,10islwd,3926,62,https://i.redd.it/65yxpugzyoda1.jpg
70,"The same people that were intrigued by injecting the bleach, UV butthole lights, eating horse paste, and drinking urine.",,x0rqji,3896,49,https://i.redd.it/ftttj2v39ok91.jpg
71,Her kids will pass.,,wi32ai,3897,39,https://i.redd.it/yan6upi0x6g91.jpg
72,Pestilence has a Facebook account,,v9b5fg,3872,24,https://i.imgur.com/qGUry3R.jpg
73,Their poor & broken cultists brain…,,w4kkce,3842,38,https://i.redd.it/qp43czg64yc91.jpg
74,Get your booster,,zeca44,3686,26,https://i.redd.it/0fbj7x65gv3a1.jpg
75,seen on the Q train..,,vwl9m1,3639,77,https://i.redd.it/g8psb28cpwa91.jpg
76,It's not over,,ynwrge,3642,15,https://i.redd.it/i0zz9bz13dy91.jpg
77,"We would have eradicated polio if not for the vaccine, according to antivaxxer",,yw7tji,3627,93,https://i.imgur.com/dX6mVr3.jpg
78,How'd that work out for you?,,11vnwng,3615,26,https://i.redd.it/q0f0zy6d5mka1.jpg
79,They did say it was hoax,,11zmmsb,3606,77,https://i.redd.it/nmnw6xe52yla1.jpg
80,A new type of booster...,,w053hw,3583,53,https://i.redd.it/y4gtg8sb6ub91.jpg
81,US Life Expectancy Drops Slightly: r/conspiracy blames vaccines and not the pandemic which killed 1 million Americans,,x34w5k,3553,142,https://i.redd.it/xe3g2hrox3l91.jpg
82,Critical thinking is hard for the Antivax crowd,,xsjv36,3551,40,https://i.redd.it/3w6rfazrw3r91.jpg
83,Sure they can't,,vshoyc,3548,175,https://i.redd.it/tshlu2hpov991.jpg
84,Spotted in the wild,,vlu7v3,3539,81,https://i.redd.it/5n47dmhl67891.jpg
85,Dr. Fauci’s only crime was trying to save American lives. For that they want to kill him.,,10mdc4c,3438,81,https://i.redd.it/1armmnz2ekea1.jpg
86,"""I don't believe in covid""",,xytwfk,3433,95,https://i.redd.it/6wwdgdll28s91.jpg
87,When antivaxx and flat earth collide you get this,,vyxyq1,3397,273,https://i.redd.it/4pb9qhasi7b91.png
88,"""You probably caught the gay from childhood vaccines""",,yxwn12,3387,86,https://i.redd.it/zhgfip48dk0a1.jpg
89,Jesus wept. These morons will destroy us all,,wrg9o1,3389,132,https://i.redd.it/hi7bgtzdbgi91.jpg
90,Leave it to anti-vaxxers to not understand why countries that don't speak English aren't googling English phrases.,,yeo275,3386,73,https://i.redd.it/x5i3o51xobw91.jpg
91,Shut up,,v64ymz,3375,102,https://i.redd.it/9b7myx22k0391.png
92,"""Unvaccinated is a slur""",,ydyz03,3364,169,https://i.redd.it/6lg14qq5g5v91.jpg
93,A true hero…,,10jn6k9,3352,154,https://i.redd.it/y3sxhbandwda1.jpg
94,"Children, a group famously not irrationally scared of needles until COVID-19",,10cpoll,3343,236,https://i.redd.it/7tg7s9qlbaca1.jpg
95,How come they never do this?,,wd5fdx,3309,34,https://i.redd.it/ecfwrob8f0f91.jpg
96,FAFO.,,10kieeh,3285,71,https://i.redd.it/7cqo3eka04ea1.jpg
97,Apologize? We're still laughing at you.,,y94kgl,3286,257,https://i.redd.it/5i46yrh8ktu91.jpg
98,"On the day of her vaccine, before she even got the vaccine. Anti-Vaxxers don't care, they'll exploit it anyway.",,yl1x26,3264,88,https://i.redd.it/eku4y50uwrx91.png
99,woof,,w3ojsj,3235,169,https://i.redd.it/lq98p9xq4dc91.jpg
100,Prasad is becoming more unhinged every day.,,xtr5pb,3231,143,https://i.redd.it/8jrf8k5zrer91.png
101,gEt UseD t0 iT,,xwivvb,3234,119,https://i.redd.it/bnlkmcshhlr91.jpg
102,Another example of why anti-vaxxers are sociopaths.,,1096ztz,3207,190,https://i.redd.it/9m64v8bi1hba1.jpg
103,It’s TRUE.,,10bf2p2,3173,26,https://i.redd.it/g5n1qv917zba1.jpg
104,Died Suddenly News: Vaccines Made a Quiet Boy Gay,,xmu1l3,3163,104,https://i.redd.it/p1v02h7is0p91.jpg
105,"Posted the top pic to this sub over a year ago, it got pretty popular, but I guess this guy has only just seen it. He had some lovely words to share. Lol, thought I let y'all see it too.",,vnk37f,3145,172,https://i.redd.it/q9sqmdw59l891.jpg
106,They have already started asking if a vaccine was the cause of his unfortunate accident that led to his death.,,yd51em,3110,93,https://i.redd.it/bm6pg239gyv91.jpg
107,Mt. Stupid - the perspective of an Anti-Vaxxer,,xrt8kc,3036,41,https://i.redd.it/w79qylnemxq91.jpg
108,They're still saying the most ridiculous things,,y9vrrs,3022,224,https://i.redd.it/ewcipmv0lsu91.jpg
109,Uh ya. We all realized you didn't care about us when you wouldn't spend 15 minutes to help protect us.,,y0vt73,3018,64,https://i.redd.it/62fryu45w2t91.png
110,Antivaxxer is getting a divorce,,z1wufp,3011,140,https://i.redd.it/krtd6zmchd1a1.png
111,"Anti-Vaxxers - blaming everything on vaccines, even if the bodies aren't even cold yet.",,yu25xt,3001,67,https://i.redd.it/5g7vx52h3qz91.png
112,Black Blood!,,yj4ytf,2987,131,https://i.redd.it/b8cdtyanfbx91.png
113,This is hilarious and utter nonsense.,,vjncrd,2966,144,https://i.redd.it/mca5exd9ck791.jpg
114,You really can't get more dishonest than this,,128psoa,2957,149,https://i.redd.it/h6vjelpd6bra1.jpg
115,Me right Hospital bad,,wdbtaj,2944,64,https://i.redd.it/oktz866w72f91.jpg
116,Why am I not dead yet? *checks pulse*,,vv557h,2917,138,https://i.redd.it/y0mxg7y0ika91.jpg
117,Ahhhh,,yaeke1,2910,156,https://i.redd.it/g93ysvkygav91.jpg
118,"""Natural immunity""",,z55vga,2906,17,https://i.redd.it/l5445o2dtb2a1.jpg
119,Magnets. They are obsessed with magnets.,,z07r19,2908,152,https://i.redd.it/mxv2ttiqhgx91.jpg
120,"Sure, the streets are littered with the bodies of the vaccinated",,12v8ugo,2899,153,https://i.redd.it/2zqdmp8hm9ua1.jpg
121,Now it's myocarditis...,,xjgykx,2885,304,https://i.redd.it/m1fyazca72p91.jpg
122,Fixed the meme that was created by an antivaxxer,"Original post: 

https://www.reddit.com/r/vaxxhappened/comments/10a02s6/another_banger_from_an_antivaxxer/",10up11n,2885,16,https://i.redd.it/jnnf9wplihga1.jpg
123,oh no you don't,,10ayaij,2863,159,https://i.redd.it/yvz19czrg2ba1.jpg
124,Tucker Carlson fans cite a Chinese journal in their never ending attempts to sound as if they know something about vaccines,,w9rx5s,2857,96,https://i.redd.it/rska2d0d7vd91.png
125,Pureblood Delusions,,w6ypin,2851,168,https://i.imgur.com/JvHd68v.png
126,Hypocrisy at its finest.,,vgncez,2839,41,https://i.redd.it/4jlymenhis691.jpg
127,Antivaxxer won't do CPR on a vaccinated person,,vxdgir,2833,126,https://i.redd.it/jhcdngmnf4991.jpg
128,Former Democrat responds to state of emergency declaration in New York,,xay7x3,2815,40,https://i.redd.it/3yz32qq353n91.jpg
129,Sounds yummy,,101g91z,2809,149,https://i.redd.it/29c8qmlkdb8a1.jpg
130,Don't know about you guys but this meme awakened me /s,,zwf6ss,2805,129,https://i.redd.it/tzdor2s9dh8a1.jpg
131,Happy Halloween!,,xvdn6d,2762,15,https://i.redd.it/ivohig577sr91.jpg
132,I daresay it’s for the best,,zf4df9,2757,68,https://i.redd.it/aejn1c1yfj4a1.jpg
133,"Suffice it to say, Red went on to claim Polio doesn't exist...",,wj5i61,2727,76,https://i.redd.it/50gj27i3wgg91.png
134,r/conspiracy posting articles from a known satire site thinking it is real definitely sums the subreddit,,wwio4q,2730,67,https://i.redd.it/djb2mswuqnj91.jpg
135,And masks suffocate you but are also too flimsy to stop the spread of SARS-CoV-2 laden respiratory droplets?,,zqxikz,2688,30,https://i.redd.it/sctrgwvgd57a1.jpg
136,Antivaxxer Murders Family,,135n8en,2665,106,https://i.redd.it/94psrejbjnwa1.png
137,Remember this? Well it’s June 18th 2022 and we’re still very much alive.,,vf0ye9,2653,76,https://i.redd.it/w98q7mp61c691.jpg
138,How does one quantify the percentage of somethings evilness ?,,x7gw70,2633,63,https://i.redd.it/1u5uc4a10am91.jpg
139,Flat Earth = Anti-Vax sometimes (Sadly he's my crazy ass twin),,zna5dm,2619,142,https://i.redd.it/tyie6si9486a1.jpg
140,This is what antivaxx sounds like,,ytdesf,2610,33,https://i.redd.it/bqa0bdbp2kz91.jpg
141,FAFO.,,10erg2b,2599,41,https://i.redd.it/96k6w7jrdqca1.jpg
142,Antivaxx employee leaving notes when they're disagreed with,,vvufed,2591,77,https://i.redd.it/ejhi73smgma91.jpg
143,Would you date this guy?,,wtaajl,2569,297,https://i.redd.it/sbi6ro2tv5i91.jpg
144,"Yes, viruses are just like farts.",,zap8cf,2558,131,https://i.redd.it/9dbq0b5l7i3a1.png
145,Someone's having goldfish memory,,11k9fdq,2558,42,https://i.redd.it/xqnn0fqgf7ma1.png
146,B-but what about muh freedom,,xiuczx,2552,30,https://i.redd.it/nn783yelwwo91.jpg
147,If an antivaxxer was to reincaranate in the world of attack on titan,,zbgllp,2555,47,https://i.redd.it/vxqk2p0eaq3a1.jpg
148,Found in a Georgia facebook group. comments were as expected lol,,xv0kov,2547,67,https://www.reddit.com/gallery/xv0kov
149,the voice of God,,wydjvz,2555,169,https://i.redd.it/xsl42pqs33k91.png
150,Thanks so much for the third summer of covid,,vp3aju,2551,109,https://i.redd.it/3ow0so381j791.jpg
151,Would you take advice on vaccines from Kid Rock?,,wg3ze0,2509,128,https://i.redd.it/ghxb8cqfzlf91.jpg
152,An X post from r/memes.,,11tj3cl,2506,32,https://i.redd.it/txjqlapnaaoa1.jpg
153,*Detoxing* their autistic child with (an aquarium cleaner) Zeolite,,11sxkym,2487,86,https://i.redd.it/d80g51r8puna1.jpg
154,BRAND?,,12lzapa,2453,158,https://i.redd.it/0tiflj9d6qta1.png
155,Anti-Vaxx looks for help,,yqmpbt,2447,81,https://i.redd.it/sjd9xs7t6ty91.jpg
156,"Another ""banger"" from an antivaxxer",,10a02s6,2434,170,https://i.redd.it/ak9mew7trnba1.png
157,... I would tell you that you're a Russian troll,,11m16zw,2431,43,https://i.redd.it/ml0ti8w3kcma1.jpg
158,He’s talking about his father.,,y31k3r,2427,16,https://i.redd.it/lldltpkrclt91.jpg
159,This.,,zbu3in,2420,18,https://i.redd.it/36cqze6l6t3a1.png
160,r/conspiracy admits that vaccines cause aging,,vfzc5s,2416,164,https://i.redd.it/hfqtnb50al691.png
161,Intact DNA,,zp5131,2409,91,https://i.redd.it/4k70w8y0bp6a1.jpg
162,"""Vaccinated people make me cough""",,yumqb9,2416,82,https://i.redd.it/v56w8s9q18z91.jpg
163,I think r/iamatotalpieceofshit would work here too,,yrathn,2411,120,https://i.redd.it/0ax3ju3hm3z91.jpg
164,Fake News,,zxcmhn,2406,192,https://i.redd.it/htznckgzd18a1.jpg
165,r/DebateVaccines can't meme,,vixusp,2391,128,https://i.redd.it/c85yfvj3kc791.jpg
166,Antivaxxers think they're the heroes of the story,,zuroje,2372,94,https://i.redd.it/can3hzr6fz7a1.png
167,The Battle Within,,134pdka,2374,31,https://i.redd.it/bym3u9hhjr6a1.jpg
168,tHE jaBbeD aRE dYInG!!11!!,,vptfyo,2347,153,https://i.redd.it/pvo8vh8rzw891.jpg
169,Elon Musk catering to Anti-Vaxxers,,zk30zu,2345,99,https://i.redd.it/tzmr6zxe7j5a1.png
170,Dire predictions from 2021,,136m2vd,2343,125,https://i.redd.it/r1r246acd7xa1.jpg
171,"""Vitamin D deficient rodeo clown"" -- new favorite insult of all time.",,ytorur,2333,15,https://i.redd.it/i75trqb5kmz91.jpg
172,They work,,130qwjz,2317,26,https://i.redd.it/b1xx2o94t8wa1.png
173,Sorry to make you throw up in your mouth.,,10o20pw,2305,36,https://i.redd.it/9k2ov4be8zea1.jpg
174,unconious,,vuc8fq,2299,89,https://i.imgur.com/ZCrVONV.jpg
175,MRW People who refused to get vaccinated want to tell me stories about how horrible it was when they got Covid,,vrmsjd,2292,26,https://i.redd.it/a1vei7l0on991.gif
176,Stew Peters doesn't like docctors,,12cn410,2288,40,https://i.redd.it/80xmggwgbiqa1.jpg
177,Covid turned me gay,,11usgq8,2282,79,https://i.redd.it/btb6awtu91oa1.png
178,Almost Twice as Many Republicans Died From COVID Before the Midterms Than Democrats,,ywzu3k,2280,83,https://www.vice.com/en/article/v7vjx8/almost-twice-as-many-republicans-died-from-covid-before-the-midterms-than-democrats
179,gErM tHE0rY iS a scAM,,wf9m1c,2277,135,https://i.redd.it/3ljnnkkveaf91.jpg
180,Antivaxxer can't believe that the law still applies to them,,vbffng,2276,60,https://i.redd.it/ua71jw8fe2591.jpg
181,Human Reproduction: antivaxxer version,,11mvrhh,2265,150,https://i.redd.it/a5n5ih1gqvka1.jpg
182,What a comparison!,,103hv8j,2270,51,https://i.redd.it/cycsgp31e5aa1.png
183,Is it a coincidence that especially Antivaxxers know so many dead people? Just asking questions.,,133j2em,2263,180,https://i.redd.it/seqjvwrlq0xa1.jpg
184,I'm not sure what it's going to take for Facebook to remove Toby Rogers for good.,,x4xkv8,2254,84,https://i.redd.it/7yxx29od0ol91.png
185,Vaccinations have been around since 1798 (smallpox). You’d think folk would understand how they work by now. 🤷🏽‍♀️,,vdobzk,2244,45,https://i.redd.it/a65h1w5m20691.jpg
186,Antivaxxer makes boastful claims about findings in a study - until the study's author shows up and destroys him.,,11p2u98,2241,48,https://i.imgur.com/BgS6eiq.jpg
187,"No, I'm not worried about $h3dd!ng, because I have a brain.",,x70k48,2234,105,https://i.redd.it/2emt41qix5m91.png
188,I can't even...,,xukkkd,2229,66,https://preview.redd.it/wj65jjcs1gr91.jpg?width=538&auto=webp&s=7832c9d2bb055d5ce7d3feb52be6545ca41a3a58
189,"""Doctor""",,y854fc,2219,109,https://i.redd.it/gx7yln7qhou91.jpg
190,"""Pureblood mates""",,ycc0yp,2225,125,https://i.redd.it/3o19n44o7wu91.png
191,I don’t think they understand Biology. Found at my local farmers market.,,1150m7s,2198,132,https://i.redd.it/8lq3p68vhvia1.jpg
192,"It’s true, I was the supermarket.",,y76avy,2199,228,https://i.redd.it/vrb3s9qaaku91.jpg
193,If these people were my parents I would never speak to them again,,zy92v1,2195,113,https://i.redd.it/fu4jk8nso98a1.jpg
194,Guess we all need to start preparing to bury half of the family.,,131ogx8,2195,172,https://i.redd.it/jbdt1z70fnwa1.jpg
195,"Well, it didn't take long for the anti vaxxers to make The Queen's death about vaccines.",,x9p05n,2191,136,https://i.redd.it/0ugdh2cwcsm91.jpg
196,"Mark your calender, get ready folks! Because here it comes, the vaccinated are going to turn into real life zombies!😱😱😱 (on September 3rd 2022)",,xhh0kr,2174,161,https://i.redd.it/egl69x6ifmo91.jpg
197,"...I'm sure these ""professionals"" are very credible.",,whovzz,2168,117,https://i.redd.it/dmbukx7im3g91.png
198,r/conspiracy getting their vaccine advice from an undertaker,,ygl4br,2159,84,https://i.redd.it/pbo6brafihw91.jpg
199,r/conspiracy asks about vaccine experiences.,,xoljhy,2141,154,https://i.redd.it/b1zdz6k9xso91.png
200,You DID just make this up...,,zoeu1k,2135,120,https://i.redd.it/fzjkmfspli6a1.png
201,r/conspiracy user will never have sex with a vaccinated woman.,,vuild5,2128,190,https://i.redd.it/8uhhoj3gtca91.png
202,“tHaT’s wHy pEoPlE AsK qUeStIonS”,,102ze3f,2116,140,https://i.redd.it/u77lhrndg1aa1.jpg
203,Monkeyshines,,126pvi9,2113,94,https://i.redd.it/8vbrgd79p6qa1.jpg
204,reddit user claims to have injected bleach to inactivate the vaccine,,xdacx5,2115,90,https://i.imgur.com/oVpxxCX.jpg
205,Mum doesn’t get kid vaccinated. Shocked that he is now suffering.,She’s treating him ‘naturally’ at home. Completely avoidable suffering for this poor child.,12o2t2x,2105,278,https://www.reddit.com/gallery/12o2t2x
206,Are you going to tell me there's a Ketchup Clinic next?,,yhefcd,2108,86,https://i.redd.it/v0rex5u64yw91.jpg
207,"""When will all the vaccinated people die?""",,12iny14,2104,163,https://i.redd.it/t6ucf6p0uusa1.jpg
208,r/conspiracy: Ukraine and Russia are conspiring to kill us all with vaccines,,xzn0w6,2083,108,https://i.redd.it/ug5wnj5gnns91.jpg
209,"Austrian doctor found dead, likely suicide, after receiving death threats from Anti-Vaxxers which led her to have to close her office.",,wbvpy2,2085,54,https://abcnews.go.com/Health/wireStory/death-doctor-faced-threats-covid-shocks-austria-87669573
210,I don’t think a single one exists,,xkpgh1,2062,43,https://i.redd.it/sqalcvh9sbp91.jpg
211,Natural remedies,,w5qrq6,2061,27,https://i.redd.it/hyp73qrmw7d91.jpg
212,Took them long enough,,11tmc99,2053,53,https://i.imgur.com/BG7a5we.png
213,Nobody is going to beg for what you got,,zspm0j,2059,117,https://i.redd.it/c68fb9o5m25a1.jpg
214,"Anti-Vaxxer being a horrible human being, Exhibit 2417a",,vdjzwp,2054,74,https://i.redd.it/zy6fpzqtzy591.jpg
215,"Arrest warrant is issued for woman who has refused tuberculosis treatment: Police have been dispatched to arrest a Washington state woman with an active case of tuberculosis who, for over a year, has repeatedly refused to isolate or get treatment for the infectious disease,",,11ixga1,2027,105,https://www.nbcnews.com/news/us-news/arrest-warrant-issued-woman-refused-tuberculosis-treatment-rcna73306
216,"For a year now, my crazy anti-vax MAGA mother-in-law has been trying to convince us that the vaccine has made my wife infertile. Today my wife left this on her mother's counter next to a copy of her vaccine card and left.",,wp4dlq,2021,45,https://i.redd.it/p0l4138pqvh91.jpg
217,The stupid. It hurts.,,10ictso,2019,87,https://i.redd.it/j557h95ewkda1.jpg
218,talk dummy to me,,13brlk7,2012,19,https://i.redd.it/b5j2zqsoynva1.jpg
219,"It's amazing just how many ""high-up"" people this guy knows.",,yhs8l7,2007,85,https://i.redd.it/8fsp8cdhs0x91.png
220,Tf is this shit reddit?,,10n3yxf,2003,105,https://i.redd.it/3p6etw1hnqea1.jpg
221,Blaming the vaccine even though the screenshot says strep infection right in it,,11xh6ag,1995,88,https://i.redd.it/plxm9r0ji3pa1.jpg
222,It’s TRUE.,,10ou57k,1990,23,https://i.redd.it/2ugfdcmbu5fa1.jpg
223,"""Everyone said I was wrong""",,12qqoc0,1975,139,https://i.redd.it/g6pvby65xmta1.png
224,Antivaxxers explain the war in Ukraine,,z6zyw5,1972,150,https://i.redd.it/wbl0j0bvl52a1.png
225,Raise your hand if you suffered from demonic entities after vaccination!,,ykcl6f,1967,125,https://i.redd.it/rz8bt3cywkx91.png
226,r/conspiracy is using carrot emojis like all the other antivaxxers,,xm0def,1963,178,https://i.redd.it/65zvqt57h7p91.png
227,Here we go…,,w4v594,1961,108,https://i.redd.it/ki30cnjzr1d91.jpg
228,"""You can't make this up""",,zqs15o,1957,108,https://i.redd.it/dcjes4aryv6a1.jpg
229,Three and a half months after the deadline and I don't have AIDS even a little bit.,,12oqirw,1956,143,https://i.redd.it/281tpu9qibua1.jpg
230,a bit sus indeed,,vi72yc,1957,118,https://i.redd.it/35qmw6od2y691.jpg
231,It’s TRUE.,,10j8u66,1946,16,https://i.redd.it/imhsjqzi3tda1.jpg
232,"When 90% of vaccinated people don’t have any problems about vaccines, anti-vaxxers say that they’re just random anecdotes. Yet when that ONE person says that they do, they say that it’s absolute proof.",,119vf14,1947,37,https://i.redd.it/2ljsl25psyja1.jpg
233,r/conspiracy is still angry about r/NoNewNormal,,wvrsiq,1936,137,https://i.redd.it/pxjrei9a9ni91.png
234,What stage are y'all on?,,yh42kp,1934,205,https://i.redd.it/2s9rhgglavw91.jpg
235,Brain damage?,,vhezu4,1935,106,https://i.redd.it/rrkmc8xjsy691.jpg
236,Just wow,,101vtqo,1929,134,https://i.redd.it/q1xz6mh5rq9a1.jpg
237,Mr. T got his flu shot! You should too!,,y2w9as,1914,36,https://i.redd.it/xkhgpk0g6kt91.png
238,Twitter should start making people prove their level of education,Her Twitter bio claims that she is a medical doctor. Yet...,12ke2di,1911,148,https://i.imgur.com/XtaNiFh.jpg
239,Yeah! Sure showed him! /s,,10p91sa,1902,58,https://i.redd.it/fv2nwvyrx7fa1.jpg
240,We are evolving just backwards,,xuc1v6,1897,20,https://i.redd.it/53244ag5gjr91.jpg
