,Title,Post Text,ID,Score,Total Comments,Post URL
816,And that 3% are usually trying to sell a garbage book too,,v66b12,119,7,https://i.imgur.com/dDnvi7Q.jpg
817,High School Diploma vs 30 Years as a Physician,,10l4ouv,117,25,https://i.imgur.com/gypDhH5.jpg
818,If only vaccines were sexually transmitted… If only!,“…they went blue after encounter”?,1283n2t,118,15,https://i.redd.it/0k0nl2a6a7ra1.jpg
819,How will you be honouring these victims this month?,,10ab9qz,121,10,https://i.redd.it/axvwglqs1qba1.jpg
820,no,,13xx9nt,121,14,https://i.redd.it/y0m6m2v59h3b1.png
821,"""Vaccines will turn you gay"" says *Natural Medicine Practitioner* in r/conspiracy",,13ny0lu,122,18,https://i.redd.it/2re3twe43f0b1.png
822,Wrong about what? The steps taken to slow the spread of Covid?,"The steps that profably saved millions of lives and prevented a total collapse of most countries budgeted to death health-care system?

Unlike any of your guys predictions regarding any vaccine side effects that we'll see any day now.",y1r4m0,120,3,https://i.redd.it/2vpb8h4i8at91.jpg
823,"Exposure to humorous memes about anti-vaxxers boosts intention to get a COVID-19 vaccine, study finds",,veljdj,119,5,https://www.psypost.org/2022/06/exposure-to-humorous-memes-about-anti-vaxxers-boosts-intention-to-get-a-covid-19-vaccine-study-finds-63336
824,Child dies of measles in Nijmegen hospital; First since 2019,,12qddaw,118,4,https://nltimes.nl/2023/04/17/child-dies-measles-nijmegen-hospital-first-since-2019
825,Let’s go Darwin.,,10jnf62,120,5,https://i.redd.it/gbm5xy8bfwda1.jpg
826,r/conspiracy: The government wants to start a nuclear war to hide the effects of vaccines,,y78ivo,119,14,https://i.redd.it/l1a6cid1mkt91.png
827,Yes the “Kool aid”with 100% mortality rate is the same thing as the “ouchie” that’s been given hundreds of millions of times…,,wiuuhz,114,11,https://i.redd.it/52v8ppwdydg91.jpg
828,Anti-vaxxer RFK Jr. files to run for president as Democrat,,12d3tr4,117,28,https://thehill.com/homenews/campaign/3936494-anti-vaxxer-rfk-jr-files-to-run-for-president-as-democrat/
829,Antivax Doctor blames death of 67 yr old with congenital heart problems on mRNA vaccines.,"Paul O’Grady was a much loved British entertainer and died today after surviving 2 previous heart attacks, a family history of heart problems and decades of heavy smoking. Antivax doctor still somehow has not been struck off.",125z9na,116,14,https://i.redd.it/9k289b3e1sqa1.jpg
830,"US court sides with NY in fight over school vaccine rules - another swing and a miss for good ol' Robert F. Kennedy and his ridiculously name organization, Children's Health Defense.",,wbkwj6,114,5,https://www.stamfordadvocate.com/news/article/US-court-sides-with-NY-in-fight-over-school-17339333.php
831,Someone please tell me this is a satire sub,,12pf1bu,115,11,https://i.redd.it/jbthaz8kzfua1.png
832,"If you read such studies, then clearly they weren't censored. Perhaps learn the meaning of words, before you learn how the immune system works.",,12k8rc5,116,7,https://i.redd.it/2t8d12s2ckta1.png
833,"I don't know whether to shit or go blind. ""Red"" is a member of my family... <sigh>",,ztkox2,116,13,https://i.imgur.com/9G0BKSW.jpg
834,Dr Vauci,,wxgh7q,108,33,https://i.redd.it/rwbibez4cnj91.jpg
835,Sounds legit,,11pjjyu,110,22,https://www.reddit.com/gallery/11pjjyu
836,It’s not like we didn’t say this was a possibility,,10d8srt,108,16,https://i.redd.it/73ey7j9t3dca1.jpg
837,"Quora, oh Quora…",,x4c8u1,111,10,https://www.reddit.com/gallery/x4c8u1
838,"No, we're not friends",,13vwkoo,109,0,https://i.redd.it/qjl648v1yuza1.jpg
839,"I came across this ridiculous sign in Laramie, Wyoming.",,11qrdjq,106,10,https://i.redd.it/rlui5s446nna1.jpg
840,Tough guy bravely resists assaulting a nurse in a story that definitely happened,,11k3jbk,105,10,https://i.imgur.com/EFoqVxm.jpg
841,Antivaxx coworkers at my sisters job,,ym1fcd,108,3,https://www.reddit.com/gallery/ym1fcd
842,Men's Sexual Health Definitely Affected by COVID,,xokihr,109,12,https://fortune.com/2022/08/17/long-covid-erectile-dysfunction-link-pandemic-health-carolyn-barber/
843,What happened? You never paid attention.,,yjeyg4,106,20,https://i.redd.it/9qnz9wrkjdx91.png
844,"Sure, Ja(y)n(e)",,xoui1a,108,5,https://i.redd.it/prv1u3f8h9q91.jpg
845,…the fu?,,13m79un,110,26,https://www.reddit.com/gallery/13m79un
846,Local anti-vaxxer telling the world how they feel!,,116d6n9,110,13,https://www.reddit.com/gallery/116d6n9
847,The Deep State wants to kill those trendy liberals with vaccines,,yxv23p,107,12,https://i.redd.it/67guy99rv20a1.jpg
848,"Lol. Rob Schneider was never right in the head, but he's become a whole new level of unhinged the last couple years.",,10mb1g9,107,5,https://i.redd.it/wj2oeo6haiea1.png
849,Overlap 100%,,v66fyg,105,15,https://i.redd.it/t5vx2dl7u0491.png
850,Clown Car,,11rbf3l,100,10,https://i.redd.it/hdc7gk16g9ia1.jpg
851,I saw this on the internet... Must be true!!! Anti-vaxxers are BEGGING for the vaccine...,,10dpaj2,104,18,https://i.redd.it/bbo32gjl2ica1.jpg
852,"Ah yes, who could forget all those G5 towers poisoning us?",,11czy6p,103,29,https://i.redd.it/sz76uqsiloka1.jpg
853,"this whole ""suddenly of a heart attack"" wording needs to stop",,10x1kqq,101,48,https://i.redd.it/7r1q9p1w11ha1.jpg
854,"""At least their genome isn't damaged, unlike those ""other"" autistic people."" Steve Kirsch is a eugenicist.",,14174we,103,13,https://i.redd.it/uszx74srr54b1.png
855,"According to this Anti-Vax nutcase, the heart is not a pump. My cardiology textbook has been lying to me!",,13w2wey,104,25,https://i.redd.it/r3607nm1x23b1.png
856,From some random post Elon made,,zsee04,98,5,https://i.redd.it/45brjwr4of7a1.png
857,These people vote,,ym1d2r,100,8,https://i.redd.it/5imyc2ikm6u91.jpg
858,this person on my Facebook. she Works in a hospital often in a place with covid patients.,,vky99x,102,17,https://i.redd.it/jd44tkuksw791.jpg
859,Right?!,,10jng5a,97,2,https://i.redd.it/5vvv54gifwda1.jpg
860,"""The goal should be the return of preventable diseases and thus dead children""",,zswmi6,100,17,https://i.redd.it/yaxmesfiji7a1.png
861,Never mind the fact virtually nobody ever has a symmetrical face.,,ybr88p,96,8,https://i.redd.it/2orq8yhe1mv91.png
862,Credit to: thelogicofscience.com,,125omci,99,1,https://i.redd.it/8mzkg9ow4qqa1.jpg
863,The genius of antivaxxers is out of this world 🤪,,10947a7,98,14,https://i.redd.it/tm3oap92fgba1.jpg
864,Getting vaccinated also helps too.,,wgdcwr,99,31,https://i.redd.it/qeg0gm97prf91.jpg
865,Clot shot caused woman's tinnitus and also her immune system destroyed her heart valve but she was saved just in time for emergency surgery,,11b8fwi,96,25,https://i.redd.it/6pueulnel8ka1.png
866,"Tom Sizemore suffered a brain aneurysm. Of, anti-vaxxers are blaming the COVID vax. The babbling continues....",,118a1cp,94,13,https://i.redd.it/1ddonl2tokja1.jpg
867,"Anti-vaccine activists who believe, without evidence, that a Covid vaccine caused Damar Hamlin’s cardiac arrest have pivoted to a new conspiracy theory to explain his swift recovery: that the Buffalo Bills safety has been replaced by a body double.",,10r2zwk,96,11,https://www.nbcnews.com/tech/internet/damar-hamlins-recovery-fuels-anti-vaccine-conspiracy-theories-rcna67722?cid=sm_npd_nn_fb_ma&fbclid=IwAR32FSWLCfjzw1l5a8YuL-Q2LVfiiOU46pNu2-AoNapttVkjL3VQJpgv56k
868,"Antivaxxer has not caught COVID because they are descendent of the people of Atlantis, seriously.",,z40lez,99,20,https://i.imgur.com/NaSyC5H.jpg
869,Idiot claims that Canadians are being secretly vaccinated during surgery,,yf13g3,94,10,https://i.redd.it/0byv25ct69w91.jpg
870,I think r/iamatotalpieceofshit would work here too,,11er7h0,99,9,https://i.redd.it/sytnuqg3d1la1.jpg
871,But the nursing home data!,,y9f1hj,97,18,https://i.redd.it/pin09lr422v91.jpg
872,Texting and driving? Np for this free-thinker!,,vbk19x,94,15,https://www.reddit.com/gallery/vbk19x
873,my local word salad on wheels,,118yqmz,96,19,https://i.redd.it/yhvf49nk9sja1.png
874,"A study of individuals with heart failure, showed that unvaccinated people were amongst the highest death rate.",,10sqqtf,90,9,https://www.onlinejcf.com/article/S1071-9164%2822%2900536-X/fulltext
875,Yes - a rumour no doubt spread by you! :),,10gtj44,96,10,https://i.redd.it/gyzyx553v7da1.jpg
876,"Measles outbreak in central Ohio ends after 85 cases, all among children who weren't fully vaccinated",,10ugqcp,92,11,https://www.cnn.com/2023/02/05/health/measles-outbreak-ohio-over/index.html
877,Found on the train after months of being sticker free (UK),"I removed the sticker once I was able to get to it. It infuriates me that this kind of bollocks is still a thing in the UK.

(Also, what are they talking about with the package insert?)",10jcs8z,95,17,https://i.redd.it/7d7lwb0w8uda1.png
878,"Measles outbreak jumps to 7 Ohio daycares, 1 school—all with unvaccinated kids",,yxk1zq,96,35,https://arstechnica.com/science/2022/11/measles-outbreak-jumps-to-7-ohio-daycares-1-school-all-with-unvaccinated-kids/amp/
879,Antivaxxer harassing people who made comments on a state health department website three years after the fact.,,12v8sfr,93,10,https://i.redd.it/6nuvwae67qta1.png
880,"Taken from a moms group, I guess her kid wasn’t vaxxed",,12fih0y,91,23,https://www.reddit.com/gallery/12fih0y
881,Did you ever want to have dinner with two Anti-Vax grifters? Here's your chance! Only $500 per person! Follow the money!,,yrpwyg,91,10,https://i.redd.it/ggu5021ez7z91.png
882,Clarence Thomas suggests Covid vaccines are derived from the cells of ‘aborted children’,,voj7l2,92,24,https://www.politico.com/news/2022/06/30/clarence-thomas-claims-covid-vaccines-are-derived-from-the-cells-of-aborted-children-00043483
883,"""Suddenly Died""",,zcd2w7,90,14,https://i.imgur.com/UtgjJE4.jpg
884,"Antivaxxer: ""We have proof that vaccines are the main cause of autism"" his source: Steve Kirsch's twitter poll.",,140fid9,94,16,https://i.redd.it/jkjmziz3m04b1.png
885,If that ain't the pot calling the kettle black.,,13gt46c,90,14,https://i.redd.it/u76kq1bzipza1.jpg
886,Is anyone else still alive or not an AIDS zombie?,,zv1qmh,90,25,https://imgur.com/a/CpPHSqN/
887,It's been swell knowing you...,,xyaf9v,88,39,https://i.redd.it/nvsosbf69gs91.png
888,Alberta resident claims that the Covid vaccine is not only killing people but that it is the top cause of death in the province. But of course the government is hiding this by marking the cause of those deaths as unknown.,,xfbj5h,92,3,https://i.imgur.com/j0hXkjU.jpg
889,Antivax student union president candidate (2021),,13b78la,87,12,https://i.redd.it/7wcqq3uhyhya1.jpg
890,Republican Mayor of a Small City is an Antivaxxer,,10luez6,86,33,https://i.imgur.com/yixSco4.jpg
891,"Even though the world's population just passed 8 billion souls, there's a vaccine genocide going on apparently....",,10h702r,89,12,https://i.redd.it/xwm4s27ma9da1.jpg
892,The more there are the less there are,,xv53gz,89,6,https://i.redd.it/6w04p5oyspr91.jpg
893,"Actually, Prof, it makes you an anti-vaxxer.",,xpn7ns,89,19,https://i.redd.it/lq6t2qzzsfq91.png
894,"Ugh, she really was sane before all this, I promise.",,x0fkqd,86,7,https://i.redd.it/cega0kz6zkk91.jpg
895,Anti-vax review… of a snake food supplier,,wrhz99,88,9,https://www.reddit.com/gallery/wrhz99
896,"My flight was delayed 7 hours, when I finally got to my destination I waited for an hour for my luggage (till 12am) only to be told it had been delivered to the wrong airport. This was my mothers response to my frustration…",,vyc1hk,87,34,https://www.reddit.com/gallery/vyc1hk
897,"World War Z, maybe?",,wjp1os,88,4,https://i.redd.it/3ck0ty1a2lg91.jpg
898,"Long read, but horses are affected by the (human) covid jab now.",,z0gobv,86,23,https://i.redd.it/3ufv83ioh61a1.png
899,TMW they respond to being called out for posting BS anti-vax tropes with yet another BS anti-vax trope,,127nfvf,81,10,https://i.redd.it/45an228r53ra1.jpg
900,Insane man on vaccines,,10rw3uc,84,13,https://i.imgur.com/pQy10kU.jpg
901,"Growing vaccine hesitancy fuels measles, chickenpox resurgence in U.S.",,zvm7au,85,18,https://www.washingtonpost.com/health/2022/12/26/vaccine-hesitancy-measles-chickenpox-polio-flu/
902,"""Particulate and Plastic shedding""",,ydyxn1,82,22,https://i.redd.it/xgvp7uwzuzv91.jpg
903,Somebody needs to tell this idiot that correlation doesn't equal causation. What a stupid argument.,,wcrcag,82,16,https://i.redd.it/4xyi2n9n9xe91.png
904,They've been counting,,13xjvmc,86,20,https://i.redd.it/5c9rzvckfe3b1.png
905,This is normal behaviour and not unhinged whatsoever.,,114bwro,84,15,https://i.redd.it/jsg09r64aqia1.png
906,Antivaxxers talking “science”,,ztgipo,84,19,https://www.reddit.com/gallery/ztgipo
907,He’s not wrong,,116mq92,85,2,https://i.redd.it/ciiwew4dv8ja1.jpg
908,The holidays can be rough for anti-vaxxers,,z1i6n8,81,23,https://www.reddit.com/gallery/z1i6n8
909,There's a lot to unpack here. Zoom In for all of it. I couldn't get a good pic of the other side.,,yvja3n,81,40,https://www.reddit.com/gallery/yvja3n
910,Idiot responds to a story about a shooting in Houston Texas,,yjcenq,82,4,https://i.redd.it/hs0w88mmvcx91.jpg
911,McCullough at it again.,,x9do03,85,27,https://i.redd.it/xg1cst3ilpm91.jpg
912,Got a second anti-Polio-vaxxer in a week. This one is claiming that definitions were changed then that there was an outbreak of Polio caused by vaccines in India.,,wlrkfk,82,5,https://i.redd.it/l500pn2473h91.png
913,Hard swipe left,,wr4apy,84,8,https://i.redd.it/do6lnm0va9i91.jpg
914,Unvaccinated people (Gray) are less likely to believe Russia is responsible for the war in Ukraine and more likely to blame other parties.,,w8cm1g,82,18,https://i.redd.it/onxlsli30vd91.png
915,"Te olde ""the Vax weakens your immune system"" BS",,12ngkcr,82,16,https://i.redd.it/hb6osyj4t3ua1.jpg
916,I got targeted by a rambling Anti-Vax eye surgeon...,,11owh7s,79,27,https://i.redd.it/ux7coqm1n6na1.png
917,"Due to this serious condition, I'd recommend caution when interacting with Anti-Vaxxers.",,y3mstc,78,4,https://i.redd.it/1ziwq4nd0qt91.png
918,"Parents refuse to let their 4-month-old baby get heart surgery if blood is donated by a vaccinated person, saying it would be 'tainted'",,z92thl,80,17,https://l.smartnews.com/gk5vd/in5avu
919,Who is funding this?,,vbmnoj,77,14,https://i.imgur.com/wiwjwxL.jpg
920,"White House considering new poultry vaccine to protect flocks from bird flu; Local farm weighs in: The Hancocks said vaccine or not, they aren’t overly concerned about the bird flu affecting their flock. “We should have more natural immunities. So we’re not worried about it here.",,120n3a2,78,9,https://www.whio.com/news/local/white-house-considering-new-poultry-vaccine-protect-flocks-bird-flu-local-farm-weighs/FFELWZM43NEKDAB4FTKOZ34DAI/
921,"The worst example of Ghouling I've seen recently, feat. accusing parents of murder.",,10qd1at,79,13,https://i.redd.it/7gqcuegsjgfa1.png
922,Famous Anti Vax UFC Fighter dead at 45 and anti vaxxers are still claiming its the shots.,,zvwgij,80,34,https://i.redd.it/aihuk3dvic8a1.jpg
923,Erin Elizabeth (Joseph Mercola's disgusting wife) has been suspended from Twitter!,,xv0msk,73,11,https://i.redd.it/hsboqsrqror91.png
924,I still highly doubt this will change any minds because there unfortunately is not a vaccine for ignorance,,wd7zmf,77,3,https://i.redd.it/fbum5oiv21f91.jpg
925,"You don't want to be harassed by Anti-Vax ghouls after a loved one's death? Just pay $5,000 for an autopsy and then post personal details about their health publicly!",,136o53g,77,10,https://i.redd.it/3xtaqdrc7oxa1.png
926,Child has an incurable neurological disorder? How about a nice heavy metal cleanse?,,11k61a2,76,15,https://i.redd.it/zzaignkwy6ma1.jpg
927,Flu Vaccination Rate Holds Steady But Misinformation About Flu and Covid Persists | The Annenberg Public Policy Center of the University of Pennsylvania,,11652lg,78,2,https://www.annenbergpublicpolicycenter.org/flu-vaccination-rate-holds-steady-but-misinformation-about-flu-and-covid-persists/
928,There is absolutely nothing creepy or unhinged about this absolutely normal behaviour.,,10ojm8t,73,10,https://i.redd.it/nnm06lkvy1fa1.png
929,"r/walkaway on a thread about guns, never fails to bring up vaccines...",,108lez0,73,7,https://www.reddit.com/gallery/108lez0
930,"""whopping cough""",,z8tkw0,74,1,https://i.redd.it/3wfk5dvv8pc91.jpg
931,"On the campaign trail, Republicans ramp up anti-science, anti-Covid, often anti-Fauci messaging",,yd0pl1,75,8,https://www.statnews.com/2022/10/25/republicans-campaign-anti-science-anti-fauci/
932,"Because historically, that’s prevented illnesses. Obviously.",,xwmbn1,74,6,https://i.redd.it/o0wa1pjxx1s91.jpg
933,DeSantis explicitly invites unvaccinated troops discharged from federal service to join his new Florida State Guard (user-submitted title),,vg82p4,75,11,https://www.tallahassee.com/story/news/local/state/2022/06/15/desantis-names-florida-marine-veteran-lead-florida-state-guard/7635725001/
934,"More than 80 Ohio children infected in measles outbreak, most unvaccinated",,zw5b7t,73,18,https://thehill.com/homenews/3788623-more-than-80-ohio-children-infected-in-measles-outbreak-most-unvaccinated/
935,How did the COVID Vaccinated sub become such a cesspool of antivaxxers and misinformation?,,zueji2,74,25,https://www.reddit.com/r/CovidVaccinated/comments/zubnw9/should_we_vaccinate_our_7_month_old_with_covid/?utm_source=share&utm_medium=ios_app&utm_name=iossmf
936,California bill would mandate HPV vaccine,,12h1750,73,6,https://www.desertsun.com/story/news/nation/california/2023/04/09/california-bill-would-mandate-hpv-vaccine/70093217007/
937,"""Natural Immunity"" works for Ebola too.",,114x1c8,74,31,https://i.redd.it/l8katxwwroia1.jpg
938,Evil non-vaccine jabs,,x13z4z,73,4,https://i.redd.it/0z5mbolerqk91.jpg
939,Doctor known for spreading Covid misinformation is sentenced to prison for role in US Capitol attack,,ve51gt,72,11,https://www.cnn.com/2022/06/16/politics/simone-gold-january-6-covid-us-capitol/index.html
940,This woman in my town gets more insane every time I see her,,110yd8s,75,8,https://i.redd.it/4guexbox3xha1.jpg
941,Some recent scientific theories AND breakthroughs regarding Covid from Q citizen scientists,,10k8io9,73,11,https://www.reddit.com/gallery/10k8io9
942,"Antivaxxer Diamond, Of Right-Wing Duo Diamond And Silk, Dies 'Unexpectedly'",,108kcnk,77,14,https://www.huffpost.com/entry/lynette-hardaway-diamond-and-silk-dies_n_63bcdb70e4b0d6f0b9fdb911
943,Have y’all seen this?,,zkhp0u,76,34,https://i.redd.it/0qdehmwuvl5a1.jpg
944,Delusional Anti-Vaxxer and their prediction when all vaccinated people will die... as if I haven't heard that a thousand times.,,ythjd3,77,11,https://i.redd.it/pp91cuxfykz91.png
945,"Can’t possibly be covid, it’s murder.",,yhe6gp,74,5,https://i.redd.it/eocna2s52yw91.jpg
946,...do I do it guys? Do I dare stare into the abyss?,,11awtex,71,14,https://i.redd.it/8fbfh54686ka1.png
947,Unvaxxed redditors reccomend seeing a Naturopath,,10snw0v,73,7,https://i.redd.it/97yq855d73fa1.jpg
948,I was waiting for this response… in response to a post explaining the most likely cause in the bills game last night,,102e6p5,68,14,https://i.redd.it/uv9372h4pw9a1.jpg
949,Antivaxxers are ghouls,,1025040,71,20,https://www.reddit.com/gallery/1025040
950,"These types of comments are now getting majority support on ANY vaccine campaign, even regular flu ones. We are so screwed.",,wd2mym,73,18,https://www.reddit.com/gallery/wd2mym
951,Sure you actually said that. I totally believe you.,,v74cq9,70,10,https://i.redd.it/ip2k1hplw8491.jpg
952,Project Veritas is a right wing disinformation source. Do not believe anything they say about vaccines,,10m0yyy,70,23,https://www.newsweek.com/project-veritas-covid-mutations-pfizer-fact-check-1776845
953,Is there an organization of Vaccine Supremacists that lynches antivaxxers? Have your children been sold away from you because you're not vaccinated? Have you been tied to a whipping post and beaten? No? Then shut the fuck up.,,10jp366,68,10,https://i.redd.it/275gc13jbuda1.jpg
954,Now they're handing themselves participation trophies.,,z3ufx6,73,12,https://i.redd.it/mx02za7y702a1.png
955,Anti-Vaxxers releasing a new ghoulish propaganda piece,,z1bfym,72,7,https://i.redd.it/if10bxj0ld1a1.png
956,So she doesn't want to match with lunatics yet she's anti Vax,,wwi5sb,72,22,https://i.redd.it/q9fbthufmnj91.jpg
957,Poison players,,wm83u1,68,6,https://i.redd.it/oya1swuvp6h91.jpg
958,You were never proven right. They live in a world of delusion,,13xk5il,66,23,https://i.redd.it/npi4xu4ypm2b1.jpg
959,"Covid vaccine hesitancy could doom future vaccines: “If taking the word of a physician like myself, who has seen and treated these diseases, and seen kids badly damaged from these diseases, is not enough, what will be enough?” said Hackell, “Unfortunately, I worry that it will be dead children.”",,zrd9as,68,14,https://news-24.fr/covid-vaccine-hesitancy-could-doom-future-vaccines/
960,20 million people dead from the vaccine. AKA almost half of Canada’s whole population.,,y9cu3s,67,18,https://i.redd.it/0k3njcrkk1v91.jpg
961,"Jab Injuries, an Instagram page where claims of severe injury and sometimes death attributed to the vaccine without any proof that the vaccine did indeed cause the injury",,wo2ztl,69,7,https://i.redd.it/070fwau3mnh91.jpg
962,random antivaxx meme,,w4mjxp,65,7,https://i.redd.it/mbymo3feiyc91.jpg
963,These get posted around my block every morning. And every morning I rip them down.,,w1ndm8,68,9,https://i.redd.it/3iqr4jnjf8c91.jpg
964,"Sage advice, seen in Durham UK",,13v3jsp,68,4,https://i.redd.it/x7w4694vjt2b1.jpg
965,Using their own beliefs against them,"Rural Cafe owner (red) who refused all public health orders during pandemic and is a very outspoken anti-vaxer had this ridiculous post comparing themselves to Jesus. Used their own book against them... ""Why are you hitting yourself, why are you hitting yourself?""",12g9dq4,67,6,https://i.imgur.com/Qgzdyv1.jpg
966,From my Facebook Feed Today,,116pr7w,70,6,https://i.imgur.com/zgu2lDH.jpg
967,"Two sons lost to measles, family gets daughter vaccinated on time | India News - Times of India",,zfi9s2,64,3,https://timesofindia.indiatimes.com/india/two-sons-lost-to-measles-family-gets-daughter-vaccinated-on-time/articleshow/96068672.cms
968,First time mom posted about her baby getting her first set of shots. Gets this in response.,,y1nh6z,67,15,https://i.redd.it/50nkthche9t91.jpg
969,And we're all still alive,,13u8tii,67,10,https://i.redd.it/p7ns9ari4k2b1.jpg
970,lol. wut?,,119kzlx,67,9,https://i.redd.it/01lev3hayvja1.png
971,"I frequently get my idiot siblings saying stuff like this in the family chat. I’ve given up refuting their nonsense but I don’t think I can refute the last comment, which is around people being unable to sue pharma companies from vax related injuries. Is their a simplified refutation out there?",,10a2qyv,67,24,https://www.reddit.com/gallery/10a2qyv
972,"Wow, so believable!",,zyrouu,66,11,https://i.redd.it/49gl5u2ixy8a1.jpg
973,Time to plan for a double funeral,,x9lms6,65,0,https://i.imgur.com/nnbwDEg.jpg
974,Young adult in New York with paralysis from poliovirus was unvaccinated and immunocompetent,,wv8rxi,67,13,https://www.cdc.gov/mmwr/volumes/71/wr/mm7133e2.htm
975,we live in the post-fact era,,wl0czl,69,10,https://i.imgur.com/O5bgqUV.jpg
976,"Steve Bannon spent ""months"" convincing RFK Jr to run against Biden as a ""Chaos Agent""",,13v6bwj,69,8,https://www.salon.com/2023/04/06/steve-bannon-spent-months-recruiting-anti-vaxxer-rfk-jr-to-run-against-biden-as-chaos-agent/
977,Column: Anti-vaxxers loved to cite this study of COVID vaccine deaths. Now it's been retracted,,12jdmlx,68,12,https://www.latimes.com/business/story/2023-04-11/anti-vaxxers-loved-to-cite-this-study-of-covid-vaccine-deaths-now-its-retracted
978,"Flu vaccine appears to be a very good match to circulating strains, CDC says",,zggedn,64,6,https://www.cnn.com/2022/12/05/health/flu-vaccine-good-match/index.html
979,The **grape** cure,,zeccxw,64,16,https://preview.redd.it/gcc4imqon84a1.jpg?width=960&format=pjpg&auto=webp&s=afa02b787b2879218ecc8945ddb15c04ae251820
980,"Spreading disinformation is just so ""fun""...",,xxc34n,65,10,https://i.redd.it/4o6e2rl088s91.png
981,In a discussion about using **human waste** as garden fertilizer an antivaxxer says that the problem with that is that the human shit might come from people who were vaccinated,,120qlzm,65,11,https://i.redd.it/w5kgudik9qpa1.jpg
982,"MRW someone on the internet says, ""My loved one DIED after getting the jab""",,10ool5x,68,16,https://i.redd.it/wzlp7yqkh4fa1.jpg
983,The CDC has updated their Covid-19 rates by vaccination status again and once again vaccine protection is still holding up the same as always.,,10ld8ht,66,9,https://i.redd.it/rj2zw7n2y9ea1.jpg
984,Polio in Arizona?!? r/conspiracy has a John Birch Society scare pamphlet from 1953 and they believe every word of it,,xavw07,64,1,https://i.redd.it/wrel60mav1n91.png
985,UK emergency alert test was going to do something bad to anyone who had been vaccinated...it didn't.,"Here in the UK the government recently tested an alert system that pings every mobile phone in the country. Other countries have been using these emergency alerts for years but a UK ""glamour"" model thinks it's going to kill us all.",13kt2ao,59,4,https://i.redd.it/cdkd0dydhl0b1.png
986,BUSTED: Florida officials cut key data from vaccine study,,12fsudk,64,1,https://apnews.com/article/florida-ladapo-covid19-vaccines-c498ffcb2393a1fffd692e1687e62e4e
987,Sacred quantum pool shedding,,wnryv4,62,13,https://i.redd.it/le70vbuthkh91.jpg
988,"Pastor and family stole $8M in Covid scam, feds say. Why no charges?",,vp4f5l,66,6,https://www.nbcnews.com/news/crime-courts/pastor-family-stole-8m-taxpayers-covid-scam-feds-say-havent-charged-rcna30379
989,Found in a public place,,vof2l1,63,27,https://i.redd.it/p3kf2yjx1p891.jpg
