,Title,Post Text,ID,Score,Total Comments,Post URL
453,It's almost the 3 year anniversary of this gem of a tweet from the beginning of the pandemic.,,11rn4nu,911,22,https://i.redd.it/11gnzh31rvna1.png
454,Apparently this antivaxxer is still bitter about lock downs and somehow thinks the great reset is for *checks notes* zoom?,,xfdi3x,913,34,https://i.redd.it/t93az7b0g4o91.jpg
455,Saw this delightful screed on NextDoor.,,w2fazr,908,93,https://i.redd.it/b96wez0jafc91.jpg
456,God made viruses too honey,,12zj5d4,910,68,https://i.imgur.com/KSfCHMF.jpg
457,Literally none of this is true,,znfpf9,904,56,https://i.redd.it/3x2rt5ng8b6a1.jpg
458,They are so close..,,12jpaz0,904,76,https://i.imgur.com/AKlTSKR.jpg
459,You ever notice how they just pretend that the things they believe are widely known and accepted facts?,,ye91cb,904,38,https://i.redd.it/e0mrm9ypt7w91.jpg
460,"🤣 There are 600,000 cancer deaths every year in the US. If they increased 143,233% every single person would be dead in 143 days.",,y19gio,897,30,https://i.redd.it/cka0825tk6t91.png
461,"Anti-Vaxxers Blame RSV Epidemic On Crisis Actors, Again | Crooks and Liars",,z2rcsj,898,46,https://crooksandliars.com/2022/11/rsv-epidemic-just-more-crisis-actors
462,Elon has really lost the plot,,140f5ob,895,34,https://i.redd.it/xz6p2vtwj04b1.png
463,This anti-mRNA stuff is getting out of hand,,xns564,877,110,https://www.reddit.com/gallery/xns564
464,A former ER doc is now against CPR awareness for children because... vaccines?,,vkjgce,876,87,https://i.redd.it/8j323lpxts791.png
465,"Found in a mom group, OP was looking for support after baby died from SIDS.",,zpi876,869,56,https://i.redd.it/j9d5iymatt6a1.jpg
466,"It really does pay to be educated, folks",,zswdd3,874,72,https://i.redd.it/z0c0a3sjhi7a1.jpg
467,Radiation poisoning,,12n6i9a,871,43,https://preview.redd.it/ylcp7nt6ypta1.jpg?width=1080&format=pjpg&auto=webp&v=enabled&s=37e80caec230f0f80ba071bb441a0b403c201a41
468,THey haunt the obituaries like the ghouls that they are,,13v0pi3,859,42,https://i.redd.it/971bbd6krh2b1.jpg
469,I got the vaccine in late 2009 and I’m still not killed,,zy2omq,852,36,https://i.redd.it/ez0c8h111v8a1.jpg
470,Suuuure he did... Joshua Coleman always knows how to tell a good lie.,,zud6w8,848,73,https://i.redd.it/t55e832hhv7a1.png
471,Can't fact check your shit when it all you post is lies,,vff1g8,849,30,https://i.redd.it/6hpv3002zc691.jpg
472,"Ah yes, Nicole the Blood Analyst, everybody! She’ll sort things out!",,129bygb,844,62,https://i.redd.it/k725cy5kdgra1.jpg
473,Important message. The illusion that Covid is “over” must come to an end.,,vnzdoc,840,91,https://i.redd.it/xv6ay8pnqo891.jpg
474,oRgAnIc ImMuNe SyStEm,,z4eaal,833,53,https://i.redd.it/ksbvbp6vb52a1.jpg
475,Antivaxxer's strict moral code prevents him from sleeping with the multitude of vaccinated women who are constantly throwing themselves at him,,10ufahc,829,98,https://i.redd.it/5wkw06htkfga1.jpg
476,This explains so much that I don’t need to do it further.,,1181iu1,818,27,https://i.redd.it/vijrxd91mkja1.jpg
477,Some idiot thinks that hydroxychloroquine prevents covid,,ztkxzc,819,45,https://i.redd.it/0imcmpt1ao7a1.jpg
478,DeSantis seeks grand jury investigation of COVID-19 vaccines,,zl6780,820,87,https://apnews.com/article/ron-desantis-health-florida-covid-government-and-politics-378f02d9e085917de5276a11511e9445
479,"Following the pandemic, ewer Colorado kids are getting vaccinated | Emergency room doctors are seeing illnesses they haven't seen in years, and it's costing billions of dollars a year to treat vaccine-preventable diseases.",,11hyxfr,807,34,https://www.9news.com/article/news/local/next/next-with-kyle-clark/colorado-childhood-immunization-rates-lag-following-pandemic/73-2b30326f-dabb-44a6-806f-f2ff4f565523
480,Oh no look what they are doing to us!,,vtsuqe,805,46,https://i.redd.it/u0mhmm1w39a91.jpg
481,Yeshua is apparently an antivaxxer,,113u6js,800,111,https://i.redd.it/j75aokj4o0ia1.png
482,r/conspiracy has quite the imagination,,wg3a5y,793,55,https://i.redd.it/81ftnkpv4ye91.jpg
483,r/unvaccinated seems to have an issue with free speech,,13qot7e,781,47,https://i.redd.it/exlp93hjtt1b1.jpg
484,Shifting burden of proof. Asking your opponent(s) to disprove “your” argument when they ask you evidence for it.,,125ga9k,780,14,https://i.redd.it/aotzkg7m8oqa1.jpg
485,Would you like to vaccinate yourself against YOUR OWN BODY?,,1381w17,780,85,https://i.redd.it/rk377jtjkxxa1.jpg
486,r/conspiracy thinks that guns will help end the next pandemic,,11wlv3l,779,61,https://i.redd.it/drtisrk19soa1.png
487,"Top Chad won't even kiss vaccinated girls, not even if they're *supermodels*",,10ugi9n,771,51,https://i.redd.it/f1p6jsenefga1.jpg
488,Antivaxx fiction from r/conspiracy,,vm2bot,770,62,https://i.redd.it/4z56rc60t5891.jpg
489,Andrew Tate proves that vaccines work.,,zydquu,766,58,https://i.redd.it/uh2vayq3ix8a1.jpg
490,They’re acting like this hasn’t been being studied for decades,,106btcn,755,71,https://i.redd.it/97gvrbdqzsaa1.jpg
491,Exploding lungs?,,13lzklg,754,43,https://i.redd.it/xa8kk5o6lf0b1.jpg
492,Dating is hard enough without having to avoid this,,12kx5q1,750,51,https://www.reddit.com/gallery/12kx5q1
493,40 questions,,zx5fse,739,170,https://i.redd.it/xv2epvpjgn8a1.jpg
494,And there’s this AH,I refuse to hide his name. He challenges everyone pro-vaccine to a debate then blocks and hides when it’s accepted.,13o9j4l,743,27,https://i.redd.it/gll2e0jl6b1b1.jpg
495,Kansas lawmaker asks for security during anti-vaccination bill hearing: ‘I don’t feel comfortable’: would require employers to grant exemptions from vaccine requirements without questioning the need for the exemption,,121wtrh,734,22,https://www.kake.com/story/48589996/kansas-lawmaker-asks-for-security-during-antivaccination-bill-hearing-i-dont-feel-comfortable
496,She’s not going to like the advice given.,,yrwmv3,736,64,https://www.reddit.com/gallery/yrwmv3
497,Lmao. Stay mad anti-vaxers Australia. (Seen on facebook as an add),,1414gny,736,41,https://i.redd.it/b0k89sny554b1.jpg
498,"I'll take ""Shit I Just Made Up"" for $2000, Alex",,13r1cpn,730,72,https://i.redd.it/tmkqbtk45v1b1.png
499,How come my vaccinated friends don't know about all the vaccine injuries? When are they going to wake up?!,,12t6xh9,732,68,https://i.imgur.com/bHEfSLj.jpg
500,Lisa Marie Presley passes away from a heart attack. Clearly only one thing causes heart attacks.,,10ajoil,730,85,https://i.redd.it/py1ojjchsrba1.jpg
501,"That uh...... that never happened, did it Homer?",,11iipb9,722,32,https://imgur.com/05Dj4po.jpg
502,First world problems I guess,,13e1c0t,719,82,https://i.redd.it/ie55mayno3za1.jpg
503,Uh I think you just have COVID,,12o8c1t,709,34,https://i.redd.it/01t3y49vgaua1.jpg
504,Got a free antivax newspaper shoved in with my mail today...Wowee lucky me...,,z8zby0,706,42,https://i.redd.it/w860dwnwc63a1.jpg
505,r/conspiracy never fails to amaze me... not in a good way,,wjg1fs,709,73,https://www.reddit.com/gallery/wjg1fs
506,To the second comment: Do you really have to? Context on 2nd page.,,y0e8o2,699,39,https://www.reddit.com/gallery/y0e8o2
507,Jesus Christ,,10g723m,690,50,https://i.redd.it/yb9va3igy0ca1.jpg
508,"Putin, Trump, North Korea and God all compete for the limited space in the mind of this antivaxxer",,vcgfz1,687,61,https://i.imgur.com/VcOk7hO.png
509,On a dog health group talking about a partially reabsorbed litter.,,yazvn6,691,34,https://i.redd.it/p24imtyzifv91.jpg
510,"Bro, WHAT???",,11wqdow,680,49,https://i.redd.it/swujt4yrpxoa1.jpg
511,Bill Gates. Again.,,13k5duf,683,117,https://i.redd.it/2vg4y8iijgza1.jpg
512,Florida surgeon general altered key findings in study on Covid-19 vaccine safety,,12ylpmx,680,35,https://www.politico.com/news/2023/04/24/florida-surgeon-general-covid-vaccine-00093510
513,"Heatstroke doesn't real, guise.",,wct2xe,675,14,https://i.redd.it/zcxlpobgkve91.jpg
514,5 year old with a head injury? I know what will fix that. A visit to the chiropractor!,,xnwgio,672,48,https://i.redd.it/lg1tu7c911q91.jpg
515,Every time someone dies antivaxxers are there to spread their bullshit,,z8u71i,668,23,https://i.redd.it/q1jgej57513a1.png
516,"guys it's true, i was the morning",,xh5wxc,674,26,https://i.redd.it/kgkqzjc0wko91.png
517,"r/conspiracy believes that ""millions of people would still be alive if we had listened to Trump [about covid.]""",,11k2etj,662,80,https://i.redd.it/x5sfbrwe8zka1.png
518,They make stuff up now and believe it themselves…,,13z93i9,665,104,https://i.redd.it/jr1exweo9s3b1.jpg
519,"A covid vaccine is a hokey pokey, apparently.",,107v4nz,659,48,https://i.redd.it/b79wqq5p04ba1.png
520,“YOU WILL NOT VACCINATE THIS CHILD” - God,,zwwhcd,656,93,https://i.redd.it/phdifv442l8a1.jpg
521,Anti-vaxxers are ignoring the fact that vaccinated people outnumber the unvaccinated ones a lot.,,119wgr2,652,12,https://i.redd.it/l4200b093zja1.jpg
522,Openly unvaccinated and using racial slurs,,13h9een,641,22,https://i.redd.it/yapvcr2h4sza1.jpg
523,Found in the wild today. Brain hurty time again.,,xs26gz,645,57,https://i.redd.it/bdq5rbqz50r91.png
524,"Believe it or not, this babble is 100% about covid vaccines.",,z83lbx,643,46,https://i.redd.it/gqgzqglkzx2a1.png
525,"Antivaxxer falls for (really bad) satire, must be another day ending in y",,11bxnni,641,28,https://i.redd.it/8smtbgu7cgka1.png
526,UPDATE #2: New Zealand case of baby who needs heart surgery - parents now preventing medical staff from performing pre-op medical checks. (More news links in first post also),,zfvhgb,637,67,https://www.rnz.co.nz/news/national/480384/blood-donor-case-parents-try-to-prevent-doctors-prepare-baby-for-surgery
527,So a vaccine caused an extra chromosome to magically appear?,,z9dxdn,630,22,https://i.redd.it/69hjg4oy693a1.jpg
528,"I am the Yiddish note, so I can confirm this tragedy happened as described",,10fucee,628,64,https://i.imgur.com/n0z2Tbw.jpg
529,Wasting scare medical resources is evil indeed,,116o51p,626,20,https://i.redd.it/y78wjs8dh7ja1.jpg
530,"Why argue with Anti-Vaxers, when you could just wait.",,10j8zhi,622,20,https://i.redd.it/awgka6o95tda1.jpg
531,"Enraged Anti-Vaxxer Arrested for Vile FBI Threats in Wake of Trump Raid — On Friday, Adam Bies wrote, “Come and get me you piece of shit feds.” On Monday, he was in handcuffs. he allegedly vowed to murder as many federal agents as possible before they got him.",,wpnq95,621,30,https://www.thedailybeast.com/adam-bies-pennsylvania-anti-vaxxer-enraged-by-trump-raid-at-mar-a-lago-is-arrested-for-vile-fbi-threats
532,thE NeW cRYpT0,,zlu7dd,618,47,https://i.redd.it/2smtfk6bfc4a1.jpg
533,Saw this on Twitter today,,zwuqvw,616,68,https://i.redd.it/y52l6y29ok8a1.jpg
534,"hahaha, test sheep.",,x1fxv1,616,61,https://i.redd.it/jc8eioq20uk91.jpg
535,Their level of delusion surprises me more every day.,,13dc6ti,604,8,https://i.redd.it/2t6m5ws7nwya1.png
536,This is totally normal behaviour by Anti-Vax quacks. There is nothing wrong about... threatening medical professionals with death for.. making vaccines...,,11mb3jr,607,26,https://i.redd.it/ips4q5ufilma1.png
537,Apparently a few vaccines are “real”,,11ks3yt,594,70,https://i.redd.it/d96loks34bma1.jpg
538,4chan antivaxxers having a normal day,,100nd55,597,41,https://i.redd.it/9sqfpo9obc7a1.png
539,Leaflet on how to fraudulently gain an NZ mask exemption but don't worry its not legal or medical advice,,x8ld6z,599,40,https://www.reddit.com/gallery/x8ld6z
540,Man who could forget the Zombie apocalypse because of the Covid shots,,117kq5p,587,28,https://i.redd.it/x4m1ixx0teja1.png
541,Typical RFK Jr Supporter,,13epcib,583,34,https://i.redd.it/jzpqrmjk00za1.png
542,"Here are the latest covid vaccine side effects, direct from crazy-land.",,10vn3hx,571,26,https://i.redd.it/7hfpjsrtunga1.png
543,A Sky News piece about Polio being found in Sewage in London. The maniacs are out in force in the comments!,,x8651i,564,35,https://www.reddit.com/gallery/x8651i
544,Bill Gates wants to kill all the cows with vaccines,,11qd2cr,564,50,https://i.imgur.com/K5ECrqz.jpg
545,Beware the Black Goo Energy! (Reposted with redacted names),,x46fpl,562,92,https://www.reddit.com/gallery/x46fpl
546,Elon Musk is arguably antivaxxer's biggest asset right now.,,13miif7,561,12,https://i.redd.it/riu0b0opmy0b1.png
547,"I didn't realize my family was this antivaxx, wow, it's wild to me that they don't make the connection that illnesses like these are on the rise bc people are increasingly refusing to vaxx. herd immunity only works if the herd gets vaxxed.",,yij8r8,552,77,https://www.reddit.com/gallery/yij8r8
548,A $1000% TRUE ST0rY,,12fqic5,552,61,https://i.redd.it/c2t3oogwmmra1.png
549,Antivaxxer is the chosen one,,116v8j1,549,42,https://i.redd.it/gqkj9ctxr9ja1.jpg
550,Antivaxxers are still whining about being discriminated against,,13ipnu2,541,39,https://i.redd.it/a95x73iihwza1.png
551,Meme of Antivaxxers in the wild.,,10kpc4w,539,13,https://v.redd.it/5bz2jj4p34ea1
552,A woman had to abort her pregnancy as her unborn child was not going to survive. Someone just HAD to question whether she’d gotten vaccinated. Second comment is mine.,,xnleht,537,28,https://www.reddit.com/gallery/xnleht
553,"""I can feel it... please help!""",,13bs0ia,533,38,https://i.redd.it/9jgenx16snya1.jpg
554,OK cool beans,,13f61ji,532,20,https://imgur.com/hp1SQzN.jpg
555,"So I was scrolling on the news until I seen this on my screen, why it has to be kids man?",Here's the link to the article: https://www.theguardian.com/world/2022/nov/30/new-zealand-parents-refuse-use-of-vaccinated-blood-in-life-saving-surgery-on-baby,za2ry3,531,11,https://i.redd.it/hz987u08qe3a1.jpg
556,Cured?,,11a0vjp,530,70,https://i.redd.it/frk3mzq0ifja1.jpg
557,"hopefully not a rule 5, I thought this was funny",,xphwqp,525,8,https://i.redd.it/tpmysgh1teq91.jpg
558,I hate it when poison jabs radiate from my monitor screen,,1372h7k,524,58,https://i.redd.it/8rv48d7o5pxa1.jpg
559,It's Tall Tale Tuesday in Anti-Vax land today!,,ydefee,526,38,https://i.redd.it/208znftde0w91.png
560,Now they're giving themselves awards,,xidb3e,529,27,https://i.redd.it/eqrhusekxpo91.png
561,"Its Official: Damar Hamlin cardiac arrest was due to 4th booster vaccine. Not 3rd, not 2nd and not 1st, but 4th.",,10o1z1o,525,81,https://i.redd.it/4vwvxzb9qxea1.png
562,An anti-vaxxer passed away—now his followers think he was poisoned with the COVID vaccine by CNN,,13piv9q,518,47,https://www.dailydot.com/debug/anti-vax-rashid-buttar-covid-vaccine-poisoning-death-theories/
563,Does this belong here?,,10yiull,515,41,https://www.reddit.com/gallery/10yiull
564,all they do is lie,,141vp0a,758,69,https://i.redd.it/ivmq9o0sl34b1.jpg
565,Being around people who got the vaccine causes severe pain during periods (one of many “testimonials” posted on the instagram account of a far-right journalist),,12emlvx,510,42,https://i.redd.it/iktpqm4ghisa1.jpg
566,"??? Cmon what happened, i thought antivaxers were open and believed my body my choice.",,12ww9a0,503,50,https://www.reddit.com/gallery/12ww9a0
567,My favorite furry Moderna scientist friend spitting more facts on Twitter!,,12r12vg,501,13,https://i.redd.it/d3hzbwf1jqua1.jpg
568,"Maricopa County reports 3 measles cases. Here's what Arizonans need to know about symptoms, vaccines",,x63x8w,500,25,https://news.yahoo.com/maricopa-county-confirms-3-measles-210351853.html
569,"Yes, the plague rats are trying to pin Aaron Carter's death on the vaccine. And no, they didn't take 2 minutes to ""Do their own research""",,yoaifv,495,37,https://www.reddit.com/gallery/yoaifv
570,"Someone please explain the science (yes, the rhetorics of transphobia are there, too, glaringly, but what is going on, biologically speaking, please?)",,12ueqhh,489,79,https://www.reddit.com/gallery/12ueqhh
571,I wonder what autopsies he has seen,,zqjw4w,489,30,https://i.redd.it/tbl1sej5b27a1.jpg
572,The Facebook page is gold,"For context, the sub r/coronavirus_ireland got hijacked pretty early in in the pandemic by the anti-vaxers, issuing permanent bans for anyone with a dissenting opinion. So the only posts and comments in there now are a gutter of anti-vax or conspiracy garbage.....enjoy",z2ywop,488,29,https://www.reddit.com/gallery/z2ywop
573,Well that didn't take long...,,110tq8a,482,13,https://i.redd.it/zits1wmtfuha1.jpg
574,Of course it has been great. You found an echo chamber full if ignorant people just like you.,,13h5zlo,483,43,https://i.redd.it/j2coys1tmsza1.jpg
575,"Ivermectin cures everything, even cancer",,xsbyia,476,29,https://i.redd.it/ubfinpnz20r91.jpg
576,100% Bat Sh*t Crazy Anti-Vax Nonsense [ Credit: u_Msbossyboots ],,w3wges,468,36,https://i.redd.it/iy0k96o58sc91.jpg
577,"The upside is, she won't be suffering on a ventilator",,11czrxz,471,79,https://i.redd.it/bvd4rqazjoka1.png
578,Qanon Anti-Vaxxer Insanity,,w98f2q,478,9,https://www.reddit.com/r/Qult_Headquarters/comments/w8yy0m/its_happening_everyone_is_dead/
579,Side effect: Low iq,,10spudy,471,29,https://i.redd.it/lskc3wdeu1ga1.jpg
580,"Performer seriously injured in a stunt where he falls 80 meters into the water, face first, while on fire! Antivaxxers: ""Jab?"" ""Jab?"" ""Jab?"" ""Jab?"" ""Jab?"" ""Jab?""",,10khk5i,471,25,https://www.reddit.com/gallery/10khk5i
581,"New Zealand High Court rules against anti-vax parents, allowing life saving operation and blood transfusion to go ahead",,zet55k,455,22,https://www.rnz.co.nz/news/national/480297/high-court-takes-guardianship-of-sick-baby-at-the-centre-of-dispute-over-donor-blood?fbclid=IwAR2UY5Du0m8I2LN04FcI0MdcvevKLupcHCVOkgZQV2B_Na_vXj1tj27C7aM
582,Steve Kirsch just making things up about SIDS,,13sel4d,462,39,https://i.redd.it/u9xw4o3p602b1.jpg
583,Your opinion is stupid,,x34hvn,454,35,https://i.redd.it/3jzekyoklak91.jpg
584,r/conspiracy: rare vaccine side effects are proof of a Satanic New World Order,,10qz8yh,458,54,https://i.imgur.com/BH5FmjI.jpg
585,"Does 102,000+77,000+27,000= 1 million? Asking for a friend",,10n82bg,455,45,https://i.redd.it/2zw80gi2qrea1.jpg
586,I got attacked by this unhinged Anti-Vaxxer again for calling out her grift...,,xnkvus,455,23,https://i.redd.it/egdtd88eqzp91.png
587,"Drop, yous.",,wgran6,448,35,https://i.redd.it/zqbzg6dbavf91.jpg
588,80 Alberta doctors dropped dead,,ypip47,458,55,https://i.redd.it/9gy5utqtkpy91.jpg
589,"New info about the covid vax, straight from the lunatic's brain.",,13kl37r,446,35,https://i.redd.it/xg4y45tdxh0b1.png
590,jake shields is one of the dumbest motherfuckers alive. scroll his twitter if you want a brain injury,,xkhida,449,17,https://i.redd.it/banwaqzl4ap91.jpg
591,"Wait, so which is it, really? COVID came from a biolab or is a made up hoax by the media and governments? Make up your minds.",,yfmhqs,450,17,https://i.redd.it/vn2z3i2mfjw91.jpg
592,Antivaxx and alt-right is no way to go though life,,yzflue,440,40,https://i.redd.it/e1kf2et5ery91.png
593,Fact: every anti-vaxxer knows at least 20 people who have been killed or injured,,13un6fr,440,41,https://i.redd.it/l3y1k6pmcr2b1.jpg
594,r/coronaviruscirclejerk is having a normal day,,wqsutp,437,30,https://i.redd.it/az1rmt0r1pg91.jpg
595,My throwaway account because I don’t want my antivax friend to know I posted it here. ⚠️ WARNING ⚠️: Cringe alert,So cringe. Possibly the cringiest thing she posted.,13jjsfj,441,66,https://i.redd.it/1v45hs06db0b1.jpg
596,From r/czech (translation in the comments),,vb565z,438,18,https://i.redd.it/odx3wiixub591.jpg
597,This one just made my brain hurt.,,wtode2,437,51,https://www.reddit.com/gallery/wtode2
598,"Steve Kirsch tried so hard to claim ""masks don't work."" Then later accidentally admits that they do when talking about eating.",,11nyyq0,431,59,https://www.reddit.com/gallery/11nyyq0
599,Insanity.,,13glzj2,431,59,https://i.redd.it/50w1gy7o2oza1.jpg
600,"Antivaxxer would rather die a slow and painful death than risk getting ""vaccinated"" blood",,zr6z67,432,32,https://i.postimg.cc/wMmLdTCc/Screenshot-20221220-194514-Twitter.jpg
601,"Just an idea but maybe if you’re serious, don’t tweet this.",,yuwqzi,428,1,https://i.redd.it/rhieec1hlwz91.jpg
602,Man impersonating an RN and spewing out covid & vaccine nonsense for well over a year,,10e50o9,429,47,https://i.redd.it/tlpvuxw59lca1.jpg
603,Normal antivaxxer having a normal breakdown,,yidvrt,418,24,https://i.redd.it/quxrxi45nft91.jpg
604,Delusional people,,vsud4h,415,31,https://i.redd.it/lss2vu9y7z991.jpg
605,Lol. vAcCiNeS tUrNed mE inTo aN adDicT!,,11erh4b,420,21,https://i.redd.it/l8obeofuw2la1.png
606,"Anti-vaxxer nurse who injected up to 8,600 patients with saline instead of Covid vaccine walks free",,za8nrw,419,45,https://www.dailymail.co.uk/news/article-11490847/Anti-vaxxer-nurse-injected-8-600-patients-saline-instead-Covid-vaccine-walks-free.html
607,I think r/iamatotalpieceofshit would work here too,,10xydpc,409,37,https://i.redd.it/5en9ycpxr6ha1.jpg
608,Oh yes they are,,ytk0n0,408,23,https://i.redd.it/yxsadmhnzfz91.jpg
609,"""Polio? That virus doesn't exist!"" says r/conspiracy",,wiuhc3,402,54,https://i.redd.it/pq00f91npcg91.jpg
610,Lol,,10wshax,404,20,https://i.redd.it/qyzi7i2qpxga1.png
611,"""Ukrainian death labs are bio engineering Covid and monkey pox.""",,x5bomf,400,26,https://i.redd.it/rqmbnupe1ql91.png
612,The nerve and disgust of some people...,,vpvsf3,401,11,https://i.redd.it/q2ndp73ko6991.jpg
613,No new vaccinations would be allowed in North Carolina for 3 years under bill filed in N.C. House,,12ztzo2,396,24,https://journalnow.com/news/state-and-regional/govt-and-politics/no-new-vaccinations-would-be-allowed-in-north-carolina-for-3-years-under-bill-filed/article_28407f6e-e2a0-11ed-be38-6ff4eb5c330b.html
614,Getting rabies to own the libs,,13zoivt,392,58,https://i.redd.it/xmugghvs4v3b1.jpg
615,Antivaxxer is turning off her wifi,,12xijyp,391,41,https://i.redd.it/89310a686hva1.jpg
616,It's easy to cherry pick to support your antivax stance,,yxel6p,385,59,https://i.redd.it/joc3t86vwg0a1.png
617,"Why yes, COVID not going away is obviously the vaccine's fault.",,100sn6l,382,63,https://i.redd.it/8k1m8uqp9j9a1.png
618,This was shared on r/funny,,zoihlo,383,21,https://i.redd.it/osu4v93rdj6a1.jpg
619,Most literate antivaxxer,,140xjun,388,23,https://i.redd.it/i3qhbzn1c34b1.jpg
620,These people are so lame,,13c92ut,381,17,https://i.redd.it/b1869rvukqya1.jpg
621,"LOL, Chimera and Foreskin Cells",,103h0r6,376,54,https://i.redd.it/ao3vte8mq3aa1.png
622,First diphtheria case in a century recorded in the state of New South Wales in Australia in an unvaxxed 2 year old. Child in Intensive care.,,vpqlyv,374,26,https://www.news.com.au/lifestyle/health/diphtheria-case-recorded-in-nsw-the-first-infection-in-a-century/news-story/b55c1668ff0844efa301920bb7ac2589
623,"""The end of the beginning""",So this is like right before the beginning of the middle of the story?,12spbuh,372,11,https://i.redd.it/xn0hfd0x31va1.jpg
624,"If you missed the ""news of mass burnings of deceased vaccinated babies""… no worries, the masterminds at r/DebateVaccines are on the case",,w1b568,365,35,https://i.redd.it/5uvn9vx8l5c91.png
625,Loathsome Mike Cernovich is an antivaxxer,,x0sv5e,362,22,https://i.imgur.com/KmH9XEl.jpg
626,You can’t always rely on your God.,,12doxva,365,9,https://i.redd.it/z3eff7n4xbsa1.jpg
627,"Vile Anti-Vax liars exploiting tragic deaths taking full advantage of Twitter's new ""verification"" system",,yrdvev,367,19,https://i.redd.it/idsof0i5v5z91.png
628,Road Hazard,,x7bgdv,357,21,https://i.redd.it/l0x4lca51jl91.jpg
629,Judge: Mississippi must give religious exemption on vaccines - ABC News,,12rpktk,357,80,https://abcnews.go.com/US/wireStory/judge-mississippi-give-religious-exemption-vaccines-98674857
630,"Former Trump adviser Michael Flynn is launching an online community for 'COVID-19 unvaccinated people,' where you can find blood donors, surrogates, and 'unvaccinated singles.' A founding membership costs $2,500.",,13taxvc,356,40,https://www.businessinsider.com/michael-flynn-launches-4thepure-online-website-covid-19-unvaccinated-people-2023-5
631,"My parents are telling people on Facebook to use and ingest borax to remove ""radiation, pesticides, parasite, vaccine."". I just can't anymore.",,128ln9z,359,54,https://i.imgur.com/QpdhFOS.jpg
632,"Hey Elon, why does this guy keep appearing on my feed? I don’t even know who he is.",,104pd6k,356,21,https://i.redd.it/9f95wyl5ifaa1.jpg
633,Did she fall asleep watching Last of Us?,,12b1uiw,353,24,https://i.redd.it/bvfubeqwosra1.jpg
634,"Giraffe died young at the Calgary Zoo, these are some of the comments on the Facebook post",,13n022k,353,32,https://imgur.com/a/OeVUyjV/
635,"""You're SUPPOSED to get sick.""",,zs6nqh,350,16,https://i.redd.it/j7nuppsbgc7a1.png
636,"As a terminal cancer patient, I get a lot of quacks and conspiracy nuts giving me “advice”. This has been the silliest.",,ya3kyd,353,81,https://www.reddit.com/gallery/ya3kyd
637,Parents refuse use of vaccinated blood in life-saving surgery on baby,,z8leuv,351,57,https://www.theguardian.com/world/2022/nov/30/new-zealand-parents-refuse-use-of-vaccinated-blood-in-life-saving-surgery-on-baby?CMP=Share_AndroidApp_Other
638,Ran into this while going to the movies today.,,12e6n7h,351,60,https://i.redd.it/wetld70rzesa1.jpg
639,Antivaxxer writes a poem,,10hvyhj,349,50,https://i.redd.it/odx6jw9ryfda1.png
640,"Trump refusing to say the word vaccine to not offend his supporters, but openly mocking them at the same time",,vvgrit,353,17,https://mobile.twitter.com/Acyn/status/1545933205508857857
641,TIL J&J is just a vaccine maker and has no other medical business ventures,,ykb4oi,345,18,https://i.imgur.com/18a1gG2.jpg
642,Oh no! They found me.,"Silliness aside, any antivaxxers within range of my Wi-Fi (which is pretty large, actually) are gonna freak the hell out.",y7rdcv,342,10,https://i.redd.it/7j0k873hkou91.jpg
643,Guitarist that I listened to in the past apparently went that route.,,wjn8vb,343,26,https://i.redd.it/f9i2xcdqnkg91.png
